temp_id,nombre,descripcion,ingredientes,precio,disponible,categoria,restaurante_id
afcb265b-2484-408f-9476-c547a8b52c7d,Culpa,Molestias et atque.,"commodi, sunt, sapiente, ipsam, provident",224.76,True,Plato fuerte,d9518fbd-6ac6-412b-a599-b54fb620afa3
c8f1b96b-2598-4a8a-b118-8bcc1d3b08c1,Voluptatum,Tempora error laborum perferendis corrupti magnam magni.,"sapiente, quibusdam, excepturi",294.78,False,Entrada,c04f7129-a8f4-440d-aa94-0aa304878ea4
46e4201c-8b6a-4e23-91b4-d20a8308b1e3,Hic,Nostrum soluta repudiandae accusamus veniam at incidunt.,"vel, debitis, ipsam",114.54,True,Plato fuerte,7563a09d-7d83-4a0e-afe5-04d27e3bc749
2153ac47-a646-4498-81ab-f294ac465f6c,Harum,Ducimus veritatis doloribus amet expedita magni.,"modi, minima",154.99,False,Bebida,d9518fbd-6ac6-412b-a599-b54fb620afa3
6ac48f9f-c724-45bd-86ca-f0eba1184245,Facere,Est suscipit voluptatum sint placeat quidem numquam.,"sed, modi",195.25,True,Bebida,347efec1-5946-47c8-b52e-d9ae8db478d2
84609107-032e-42a0-9a03-b644275449ab,Culpa,Expedita ex reiciendis aspernatur quidem.,"rem, doloremque, dolore, quaerat, a",59.63,False,Plato fuerte,59a2f4ad-d1ef-4b62-b450-2cd7ace4d428
ea5500d7-f606-4f52-b6f9-6b254940b811,Natus,Cupiditate aliquid quae veniam.,"inventore, voluptates, iusto, aliquam, alias",158.07,False,Bebida,854db234-1f65-475a-bd90-785242cf60ff
42eb4ddc-1ce3-4d76-8848-5311252473d0,Recusandae,Laudantium sunt illum asperiores temporibus accusantium.,"provident, veniam, cumque, eius",103.95,True,Postre,0960ad33-b10b-421f-b49a-f7529289e006
04fce727-022f-48e4-be26-c0b721e9018a,Eaque,Ab accusamus odit temporibus nobis iste vitae repellendus.,"dicta, quam, ipsa, beatae",289.26,True,Plato fuerte,507c2891-d7d8-4df7-b799-53c894a19f4a
360f0cd7-49c4-4b1a-87ea-49f6027ccfed,Sunt,Unde placeat cumque cupiditate dignissimos ipsum.,"beatae, vitae, blanditiis, quos, quibusdam",200.11,True,Bebida,59a2f4ad-d1ef-4b62-b450-2cd7ace4d428
40654944-069a-4dad-b4e8-760df1267677,Eos,Doloremque tenetur alias numquam quam exercitationem quis.,"autem, pariatur, vel, nemo",255.9,False,Plato fuerte,d9518fbd-6ac6-412b-a599-b54fb620afa3
5933f3ac-bac8-4e89-88d5-deb249045889,Temporibus,Totam atque illum id earum illo fugiat.,"ad, neque, id, id",264.4,False,Plato fuerte,56de922c-a1bb-4246-98a7-b15ba656c0a3
1a870a2c-56ac-43ab-899b-5e0538adfeb8,Earum,Eius aliquam doloremque incidunt debitis alias at voluptatibus.,"dignissimos, fugiat",102.31,False,Plato fuerte,7563a09d-7d83-4a0e-afe5-04d27e3bc749
d7155136-2cc6-4819-819f-79831533c878,Iusto,Natus libero magni.,"distinctio, ex, odit",276.77,False,Entrada,347efec1-5946-47c8-b52e-d9ae8db478d2
1779d6c3-f17c-4969-ac07-722c3d6520c2,Animi,Repellat reiciendis laborum fugit.,"eius, aliquid, qui, quibusdam, aliquid",112.92,False,Bebida,fa2ed7f7-001e-41ab-a250-ff8926c2c26c
ece300b0-09f4-4c20-a444-1ccf08788a8f,Sapiente,Laboriosam mollitia dolores ullam assumenda nostrum.,"nobis, error, quidem, animi, odio",118.73,True,Plato fuerte,7c2b48e5-32c2-47c6-9c53-17fc38ef7512
3ebb4209-938b-473a-baa6-f5496e2adc13,Quisquam,Impedit soluta perferendis molestias delectus.,"qui, cupiditate, deleniti, doloremque, voluptate",209.9,True,Plato fuerte,3e8afa40-cc93-4fb0-b129-b224ff23627f
7ddad7de-f7c3-4b11-a24f-db99365573a5,Quam,Nihil culpa non maxime.,"nulla, modi, pariatur, accusantium, ex",265.91,False,Plato fuerte,4a00321e-a5fa-491c-b7ad-04ec45baeda3
f70e061c-776e-4630-8b1f-207fc8282539,Consequuntur,Enim reiciendis magni corporis est.,"in, ipsa, minima, quae, ad",108.85,False,Bebida,fcf3885c-fe1f-408a-b3d0-b7f74fb368f4
dacbf434-55ec-4a5a-8859-f9fad2565fbd,Nobis,Voluptatibus quidem necessitatibus dicta soluta ullam.,"maxime, incidunt",282.84,False,Plato fuerte,166e45e7-0158-41cc-a09c-1cae75cdc751
dcb7b4e1-9ac8-4dc7-9620-8c210acbfd76,Tempore,Officiis hic ad culpa enim dolor.,"quaerat, suscipit, iure, possimus, enim",259.15,False,Bebida,017e1cd1-5bbe-428a-a468-214a2d2f1fe0
fd204e62-f285-4afe-a135-c445ecbe38fe,Commodi,Quos hic in maiores quas dolores cupiditate.,"sed, eos, quo, in, nisi",171.81,False,Postre,3aaadacc-7046-49c6-ba9b-b0fa7f32365a
c0a9395f-9cd2-477e-ad05-499ff29f7f04,Sed,Nisi maxime a reprehenderit ut aliquam a.,"dolorum, praesentium, qui, in",212.0,False,Postre,fcf3885c-fe1f-408a-b3d0-b7f74fb368f4
e85a28f9-2f00-4e28-8668-8fed55d9e2fc,Tempora,Pariatur quis itaque necessitatibus quas eligendi ad.,"iste, sunt, ducimus, delectus, quia",78.62,True,Bebida,854db234-1f65-475a-bd90-785242cf60ff
7d4f94e7-71b1-4604-997b-600e6dc4b597,Quaerat,Ratione aspernatur aspernatur sapiente vero mollitia accusamus.,"dolores, eum, natus",123.59,False,Postre,5ed93c2c-3839-4344-bd8c-6f5eda7a1d9d
3a6a0c01-3fc0-46a8-bcef-ca57a4e419cf,Numquam,Voluptatum ullam rerum ab dolores.,"magni, consequuntur, dolore, iure",226.99,True,Entrada,3e8afa40-cc93-4fb0-b129-b224ff23627f
803bdac9-141c-46c9-a31d-152e0da46852,Mollitia,Vitae vel tempora debitis.,"natus, officia",198.2,True,Bebida,eab3afd1-a29a-4208-af86-8517249ebefb
d632b54a-e7d2-4480-9421-506a1008175d,Deleniti,Dicta doloremque magni corporis dicta quibusdam beatae aspernatur.,"officiis, ipsa",290.91,True,Postre,0b2daedf-c3a1-4e1a-8ab4-e4f0c11555fa
3e30f19d-b317-4f6f-812c-511c21f98d44,Omnis,Aliquid deleniti odit culpa dolorem rem sint.,"doloribus, soluta, veniam, repellat",196.4,False,Entrada,4a00321e-a5fa-491c-b7ad-04ec45baeda3
7803bc17-58a6-49fd-9358-97bdb36e629e,Accusamus,Minima non aut.,"aliquid, omnis, quod, pariatur, ex",177.58,False,Postre,3e8afa40-cc93-4fb0-b129-b224ff23627f
9edb53a1-aa4a-4b54-a660-cb66deb0138f,Excepturi,Explicabo optio ea ipsum.,"ipsa, voluptatibus, qui",133.51,False,Bebida,c04f7129-a8f4-440d-aa94-0aa304878ea4
a229b7e7-42ae-4c38-9c57-c159578d10fb,Optio,Officia ipsam nihil quisquam.,"nemo, numquam",99.94,True,Entrada,9eee8071-3181-471d-a6a5-5a808cca9980
ee9916f4-cba1-4cf3-82da-e4d342f255fc,Animi,Aperiam possimus modi quod non temporibus nesciunt.,"iusto, facere, velit, similique",297.97,True,Bebida,0cf562ba-f398-4bb6-929c-857684940bef
313a38c7-e4b9-46b6-a7ed-92ff1508dc53,Nobis,Consequatur recusandae ipsam accusantium molestiae.,"nulla, blanditiis, dolores",130.61,False,Entrada,017e1cd1-5bbe-428a-a468-214a2d2f1fe0
8bdcee7c-4d0d-4a4d-9bc4-70262793b055,Ut,Dolorem sed iure reprehenderit impedit commodi.,"animi, quas, officiis",247.2,True,Bebida,0cf562ba-f398-4bb6-929c-857684940bef
c9fabbea-ff6b-452c-8a98-0d85487078aa,Eligendi,Maxime voluptatum velit veniam unde rerum.,"doloribus, at, eaque",61.96,False,Plato fuerte,8b5cc1c3-d3bd-4379-9cbf-55e566f44685
2ebbc98e-2627-4ef0-9ef5-282b2f0fbe3b,Quasi,Voluptatibus quae quam vero dolor.,"voluptas, amet",213.7,True,Plato fuerte,82f0f0ab-f50f-490e-9ae1-2619f93b3ecf
10943b56-8399-4743-933e-3bcc22b131fa,Laboriosam,Amet delectus amet.,"enim, a, enim, dolore, magnam",176.36,True,Bebida,4080a4cd-67a8-4bd3-b46e-6f7351c10029
f62a3b58-1d0f-47e6-97da-4c9872ba0291,Assumenda,Modi cum adipisci necessitatibus nemo.,"eum, recusandae, praesentium, eius",209.69,False,Postre,166e45e7-0158-41cc-a09c-1cae75cdc751
6e3e4e58-b4cd-4e75-ad18-31cc77d253a1,Temporibus,Ipsa veritatis nihil hic a rerum.,"sit, minus, expedita, sit",258.04,False,Entrada,8b5cc1c3-d3bd-4379-9cbf-55e566f44685
953c9611-d9af-4c14-87d1-f8a705b65c42,Nisi,Molestiae iusto veritatis facilis.,"harum, autem, quisquam, consectetur",128.83,True,Entrada,0960ad33-b10b-421f-b49a-f7529289e006
1ac2fd0c-0768-40f3-a395-34b9872012cb,Eum,Assumenda ducimus quaerat adipisci atque ex vero.,"asperiores, officiis, laborum, error",89.19,True,Postre,507c2891-d7d8-4df7-b799-53c894a19f4a
de697b25-5d2b-4270-b21a-ff76d163b0b5,Rerum,Ea cum dolores possimus amet vero.,"alias, repellendus, ipsa, fuga, sit",273.75,False,Entrada,82f0f0ab-f50f-490e-9ae1-2619f93b3ecf
e06244e7-186c-40bb-8795-04ad8d67d990,Voluptate,Quae molestias dolore ullam laborum quo ut.,"nesciunt, corrupti",203.72,False,Postre,3aaadacc-7046-49c6-ba9b-b0fa7f32365a
52af1f8f-430e-4788-ba2f-9fcf089f3508,Pariatur,Molestias mollitia illum soluta tempora culpa aliquid.,"id, voluptatibus, facilis, eum, aspernatur",103.2,True,Bebida,de7234fe-8869-44d6-a05f-ac03f827f1da
096ec49a-ffd7-437e-9278-095a6f02d4af,Dolorum,Corrupti at animi dicta.,"perferendis, at, sit",209.44,False,Plato fuerte,8ccb58a1-4523-41db-92b2-4c5cc348a28c
599fb993-9e7c-4106-b651-dfb13585467e,Alias,Est tempore quia quibusdam.,"quam, dolor, voluptatibus, nihil",165.68,True,Plato fuerte,ff6b97f0-54a8-46c7-9cf0-7e3c8c1457db
0e194f1a-b7da-48a2-abbc-a421c42541e2,Harum,Minus accusamus adipisci ab explicabo atque.,"vel, iusto, quae, incidunt",178.36,False,Plato fuerte,cd8f5802-9185-45fb-8d41-e140e37333c1
814ba6e9-5c03-4c59-b272-ae091ff53f0d,Tempora,Consequuntur fugit quod quisquam repellendus reprehenderit assumenda.,"voluptates, illo, dolorem",133.21,True,Postre,090f2be3-cae0-4be5-89d7-d90367f69496
3e6897a8-2f4d-45ac-82fe-af74e6d216a3,Ratione,Natus sed unde voluptatem molestias in voluptatum.,"hic, nesciunt, quae",186.73,True,Entrada,017e1cd1-5bbe-428a-a468-214a2d2f1fe0
28b19498-20bf-4e1b-820e-ee62a6d8af05,Ad,Officia voluptates officiis aperiam rem dolorem dolorem.,"ullam, sapiente",89.16,True,Bebida,876ad4fc-44cf-4655-b2ac-3464e13bde59
1da53508-75e6-4d33-874e-0b72752417c6,Fugit,Culpa quidem ut.,"quas, error",289.46,False,Postre,017e1cd1-5bbe-428a-a468-214a2d2f1fe0
06598a55-57fd-4ed1-aece-7a1006c27b7c,Maxime,Eveniet impedit nisi quasi ad saepe laborum.,"esse, a, odit, fugiat, sequi",118.49,True,Postre,09444248-5633-4b28-a7ec-a17aa802d1ac
af097236-3d8b-4dea-9a3f-b8a130bc09ea,Quo,Exercitationem quas nemo cupiditate quam fuga.,"excepturi, blanditiis, ipsam, facere, facere",213.57,True,Bebida,f83e29db-97ff-4499-8a30-55118cb97139
65665f06-829b-4e29-a7dc-8fbd1b2fce6b,Quos,Quidem doloremque tempore illum ad provident.,"voluptatum, enim",171.62,True,Plato fuerte,7bb917dc-272b-4d84-85c6-96b3a52f7ced
31a4adeb-dd27-41d0-aa66-92c3e66d0d70,Vel,Ratione doloribus nemo libero dolorem culpa.,"esse, ad, facere, cum, iste",146.56,False,Plato fuerte,7563a09d-7d83-4a0e-afe5-04d27e3bc749
