temp_id,reviewed_id,type,usuario_id,comentario,calificacion,fecha
b361b0ba-2769-4fbf-93a6-510f225b7997,546afa7e-ebac-4c9e-b298-becf456c3c3e,restaurante,4f85ab7b-ea19-4a68-9a58-cde70384be14,Occaecati nulla accusamus tempora et.,3,2024-05-28 02:45:00
5e163c0c-3064-43a9-88b1-20b03f4001e6,7cf6f4e3-3cc0-4c0b-9fe7-edf277f53606,restaurante,a08eb69d-ebb4-40df-b1fe-94c20a221e49,Quisquam autem incidunt.,3,2024-06-04 04:45:00
dbc9213c-b63a-4edb-96f6-9d2e95095a67,1072aa71-55db-48f7-98f5-f922ac8ffcdc,restaurante,bc11ac14-5ba9-4c10-bdf1-b625c2c4442f,Consequatur delectus quisquam laboriosam soluta.,4,2024-09-13 02:30:00
affe2f62-6c49-4607-aa90-dbea2864d861,759ee2ad-9d84-4080-9a85-d435b01bc1a8,orden,3097c593-04c7-4105-8b6d-ae3e4b5d1c23,Tenetur similique rerum numquam consequatur autem.,5,2024-10-31 23:00:00
528d8e2c-47d9-4fe2-9d12-b2f084a4463d,1a48732a-c81c-46ab-a589-0b8ccfb02fb7,orden,2ec7fc37-ec74-4ac9-82cd-e25b9b5e15cc,Perferendis quasi ipsa alias eos.,4,2024-09-25 18:15:00
9c23554a-c58b-4164-be6c-38f7cf0c95e0,f4c56bc2-dc28-4e2b-93a6-188cbb07b899,orden,64295097-809d-4227-95ed-7745fed34315,Impedit sed temporibus iure corporis ex quae.,2,2024-09-24 04:00:00
d1bcdd61-3dca-42bf-b14c-24af1b2b21d5,295d8818-fe5a-40d6-b108-f123e715b74f,restaurante,8b6f1115-e892-46d4-866e-76eb49d6a5b9,Minima quidem consequuntur culpa ut iusto commodi.,5,2025-04-27 15:30:00
9a6ab7f3-18a6-44ca-aa36-7c58d4717273,e00d241d-c2dc-46dd-ac97-97ca3e40056e,orden,574adbed-5024-40d4-928b-2f87a510c8d2,Voluptatibus nemo maiores.,2,2025-02-26 16:15:00
0d0daec9-39d9-44bf-9c5d-1dee3369b923,f97c94d9-f87c-49a8-bbdb-06ce4cc1d9bd,restaurante,5884dd31-405d-421a-86fa-8861cdb14864,Autem autem quas maiores ea quos ad aut.,4,2024-07-06 06:15:00
333790f5-317c-46e6-be62-874669332a3a,39507950-b2b7-4cd3-854d-f06cec011a20,restaurante,26cc400e-b3aa-4bb8-8ad1-d928726be810,Nisi molestiae ullam similique repudiandae tempore in.,1,2024-07-08 17:30:00
c203dea9-faf4-4c6f-9906-a131611edb06,9770d8fb-2dda-40b7-9cfc-8f6d5759e926,orden,9a22350f-db47-4f37-82a1-35343db5af76,Laudantium tempora vitae minus ut magnam.,4,2024-07-04 20:30:00
b4337a8c-5d2a-4827-abd5-cc2ef844650a,efe3a217-a047-4f3b-84c6-9db71a88c847,restaurante,377b7fa2-fcb7-4a4e-af5e-a179f5273f01,Quia illo sapiente.,4,2025-04-25 16:45:00
aa4dd93f-54b0-4f63-8ab6-cec6f6322ba7,b5bca73c-d939-445b-8699-8854d748d314,orden,6c321920-574b-4f92-8161-845e6b8b9510,Fugit dolorum iure.,4,2025-03-13 14:45:00
87ed7998-1913-481e-a986-530a8cdf8f5a,743c7c2f-da85-4242-9e1d-bb292b7d0bc3,orden,0f2cd6b6-2e65-4527-804d-4c1abe09fcb7,Odio cupiditate tempora totam ratione deserunt.,3,2024-11-16 18:15:00
467719ec-223f-4d5b-8b82-1cbe043242f9,4f8c2a5f-6dc5-4d74-b33c-7a3027253a4c,orden,08c9c757-4b35-4bdb-952b-ef33118e2f13,Cupiditate necessitatibus fugiat cum earum incidunt maxime.,1,2025-03-23 00:45:00
4f7ea6a0-51a0-4f61-898a-02e1ead48271,fd315413-4757-4f56-8c92-c321de95bf3e,restaurante,fce40cc3-9029-4442-bb18-4ec99091508e,Delectus libero maxime quis sed.,5,2024-06-06 17:45:00
87131420-1d6f-4187-8c3e-89180970d1c9,39507950-b2b7-4cd3-854d-f06cec011a20,restaurante,ecca5d81-9402-4b4e-afc6-01bb7401a24a,Ratione repellendus adipisci laboriosam.,1,2024-12-27 22:45:00
a1d62c2a-5ad1-4076-8a2f-59325b76be30,f33fe30d-d069-4539-bb8d-5c64a5a081d1,orden,f2a519ce-ed6a-4fa5-8d12-15d4aa85963d,Sit velit nemo quae quam natus.,1,2024-08-31 07:30:00
eb97201e-2f8d-4524-b1f9-775fe994eed2,c5d71192-0a62-4175-aff5-3a1b7266039c,restaurante,cd9f40e8-875f-438f-8cc6-b943416e9089,Iste nemo assumenda nobis.,2,2024-12-31 02:00:00
85878404-c1fe-402e-92d8-ed33e7c43c67,2dee7331-b15b-4909-a738-6989219bff8d,orden,7097e07f-bef4-4fe5-b774-5fe4717b1238,Deserunt odio debitis eos assumenda illum sint.,5,2024-06-15 20:45:00
73e6ed75-454e-40a5-a83a-3e0479446015,9e1a5a3d-f513-43ff-bfbd-56682dbf3e25,orden,e9858dc8-6c5e-4e1e-bc4f-16180aa9094b,Necessitatibus veritatis quae eaque sed molestiae.,5,2024-06-10 11:00:00
fb0c6aac-f3ad-48fa-a5c0-a0a8ea98e400,2d616741-9cca-4efa-9169-10f057f0c505,restaurante,5b661cf5-e4eb-47c1-9450-7ae9a7cfa45f,Eligendi ad voluptatum exercitationem eveniet sunt ea.,3,2024-05-24 11:45:00
9611e8c0-95e0-487d-8a03-f9c92043fca8,2868b2c8-3288-47e8-ac20-bbff92acdeec,restaurante,33ab7c3c-3487-4c41-bc6e-11ae15ee1cbd,Odio repudiandae eius.,5,2024-08-02 13:30:00
4309a750-e32a-4dbf-bb59-ee82fb221c45,a292fa58-b97d-47bc-8981-ea59fe94f71e,orden,9e58f91d-3c34-4605-8b0c-e74fbfc8e51d,Quasi assumenda nihil sed numquam quibusdam.,2,2024-07-07 03:30:00
6d7508f2-7c0d-46b4-bbe6-2761757bffea,9a08bff3-1cfb-4b10-933d-980c5623b5af,restaurante,d5b76736-244a-4d37-915e-ddf5289605dd,Officiis similique rerum.,1,2024-11-03 12:00:00
e5628ba1-3c47-47bc-8257-07cb5ef4228f,584fc9b2-91d8-488f-ae76-e49a38d50dd2,orden,6b764848-599d-4158-a677-3fce8f3e9cd6,Sint rerum harum vero.,3,2024-05-28 00:30:00
c3892b1a-795c-4d7a-a222-f320e45fc56b,5dde1c3e-a5a1-42e7-bbd5-3b64746afc21,orden,6bed0da9-b587-48dd-aac9-19b79a2359a2,Similique veritatis asperiores blanditiis ea accusamus enim.,4,2024-11-26 01:15:00
cb071cea-419b-4f69-a238-d58b96bd01ac,2d2b4306-f6be-4122-bfee-6c819a4ddbdf,orden,4b216a7a-8adc-4208-942d-088c79f103d1,Ab fugit at non eligendi.,4,2025-02-28 14:45:00
91de5778-1ab4-42b0-839b-69136248b135,e0d0ec8f-7e7c-4e2c-95f5-f52789af2bf3,orden,2d40bbfc-6240-4c1d-999a-d50936c709de,Tempore non nemo magnam quia.,1,2024-09-03 21:45:00
17483126-5d7c-409e-a788-b26ad710f9fe,d3f5ba7d-a2ed-4e02-94ba-c35b76877ef8,restaurante,acc44ee7-0f72-4e8b-b6f9-dbf5cb80b67d,Voluptas deserunt at laboriosam.,1,2024-07-11 04:00:00
f72f2de8-3fbe-4edc-b00f-f3a286b32706,6b6f0d59-d92f-44b6-a33c-d879ce23b1c8,orden,d9fda04c-725c-4e3c-ad10-b08ff528e07c,Ducimus eos repellendus est velit.,4,2025-04-23 12:15:00
379cdb77-4514-4669-9b8a-21e110c2375c,69168234-1c5a-4612-89b9-22c298ed07ae,restaurante,1a5a29a6-d27b-4a55-9dc9-6d5df0bc439e,Commodi rerum neque maxime voluptates vitae porro vel.,4,2024-08-01 14:45:00
94c7faef-303a-4128-9560-c0f672f8535a,8010b0d4-dc44-4271-853b-0ae4308ed4d7,orden,900de4f1-0639-4efa-aae4-a1342a6299af,Mollitia et veniam suscipit vel blanditiis eaque quam.,5,2024-05-27 08:00:00
1675bb72-6eb8-4895-b997-3bc2cda496ad,40585842-2215-404f-8f87-c32a8b889150,orden,41179cd4-c0aa-49ab-892b-f7aa8aa1c69d,Natus neque error voluptatibus incidunt vel.,1,2025-02-10 11:45:00
5f54ffcb-a82b-42aa-b1d2-5e2510585289,efe3a217-a047-4f3b-84c6-9db71a88c847,restaurante,27c5ab57-3c56-413f-b1ff-be5aca5ecc8b,Saepe sed consectetur explicabo ex natus iusto.,1,2025-01-05 15:15:00
2ca05584-035e-4d1a-bf1b-a257a6570721,d0976631-2581-492b-937f-5dbad3ee1e2e,orden,a746be9d-6cc9-4078-b65d-e267b0842bbb,Dolores consectetur quam cupiditate illum pariatur.,5,2025-01-18 13:00:00
4b35db19-efb5-45aa-ad9d-71e39488af73,5a1f877e-04f7-41df-ab43-e6ec1f8a181a,orden,f80a4b47-c297-40d4-ada4-1696cf3b1fc7,Saepe qui illum dicta quasi recusandae.,3,2024-06-17 09:45:00
12b81d3d-2185-449c-bb66-5ad28e4248b4,42f90331-188e-4be1-acfc-5a5c7f0561b8,orden,dfc006f5-1dd8-4ee5-acc7-d98398c3138f,Quaerat numquam molestiae consequuntur.,5,2024-08-02 12:00:00
7865e8ac-926c-48fe-9c50-262c65eefa9e,69168234-1c5a-4612-89b9-22c298ed07ae,restaurante,3069a6f6-40c5-426b-bcd9-11270b180ad0,Commodi officiis laudantium quaerat dicta.,5,2024-10-11 18:30:00
e8fcfdce-f7a0-47ff-a24f-3a6ee1d3d6fa,d3f5ba7d-a2ed-4e02-94ba-c35b76877ef8,restaurante,7dee3f5f-228f-475a-8ce2-59dffa86f48f,Sit porro fugiat libero.,1,2024-09-10 04:45:00
e5496fe9-6d1f-4c20-b6c6-16d12c21a047,46adacac-7b2f-4d28-917d-8f3a476eb55e,orden,c023f92a-af8a-41f8-84ed-226f7747569d,Aspernatur accusamus voluptatibus omnis.,2,2024-07-26 00:15:00
b22c9b4f-cc45-4820-849c-780887a5b802,a292fa58-b97d-47bc-8981-ea59fe94f71e,orden,7dee3f5f-228f-475a-8ce2-59dffa86f48f,Natus nobis accusantium quod debitis doloremque.,3,2025-03-14 22:15:00
e1dadb1f-5080-440c-9bc4-53b5fa032617,25190d89-58a7-4067-874a-363124dd8f73,orden,859c4951-ccd4-471f-9808-c3d7cc2329b6,Assumenda ad ipsum esse voluptates deleniti quidem a.,5,2024-05-12 00:15:00
782ddabb-35d1-4dd4-92a9-ebcd33c0b50a,d7ecca77-12cf-49af-9178-bfb73002016e,restaurante,9822c96c-f690-44bf-886c-b400fb2e614e,Veritatis a aperiam id quo officia.,2,2024-06-08 00:45:00
1243951f-f870-491f-bb85-a95c5a5ec058,295d8818-fe5a-40d6-b108-f123e715b74f,restaurante,519c6235-12da-46f8-a2a0-23192edc51f6,Mollitia molestias labore iste asperiores quos voluptates occaecati.,1,2024-05-25 19:30:00
2ae0a15b-1b86-4193-9389-2fd1d0cf993e,2a9555c2-bae5-4c86-881d-5f1649d51893,orden,e07a7a02-d249-4de1-b986-c97557340ed9,Atque voluptates repellat ad.,3,2024-11-26 03:15:00
66ca856a-e42f-438a-83d2-81900bba01a1,67747616-0aea-4292-8edc-334f61cca217,restaurante,78284e4d-46fe-4971-88b4-b08c7c109a94,Veniam vero possimus fuga labore facilis.,2,2025-04-08 09:45:00
a244af98-cc59-4e50-9a90-79ec9784fd2d,79eaebd7-50c5-4fb1-9107-b6fe5d180a6b,restaurante,31570bbc-3dc6-4d85-ab41-8602204f449a,Consequuntur harum omnis omnis neque pariatur.,5,2025-02-13 07:30:00
7283513f-c3c4-4717-8f48-3253df514b08,641b1db8-0ff4-4f56-a98d-5976b3311992,restaurante,813f5391-97f5-46f8-9812-176f943265be,Quos corporis odit consequuntur odit explicabo.,4,2024-05-24 20:30:00
49e37307-81a8-4995-a739-a3a84d98c7e4,2392b6ac-9b83-48db-bad5-706503e70a4d,orden,754eef8d-6815-49d1-a0c0-13f0ce68eddb,Perferendis in voluptatibus sit sequi.,5,2024-10-26 22:00:00
50a496dc-37af-417c-ae72-24455f5e044f,b5bf4a77-f5ed-47fb-a20f-6ff52ad3462b,restaurante,37808cf2-50cf-4363-b16a-4ed61abcfff7,Inventore fuga iure sint.,5,2024-11-07 18:30:00
ce64d294-962c-4b98-8ca0-55826c299c8f,9a08bff3-1cfb-4b10-933d-980c5623b5af,restaurante,9f689e2c-a89a-447d-a9a2-6b842587b486,Neque quia dignissimos sint ratione excepturi.,4,2024-10-14 09:00:00
b998e140-59d3-4033-a670-dd4df0d72e03,a87e94ab-7f46-4dac-ad98-4a7bda1e0f3d,orden,84a36966-9ba9-4987-9d6e-75fb9b6c66e0,Eligendi nostrum dolores ratione reiciendis labore.,3,2025-02-05 14:00:00
32b8cfdc-b16a-4a4f-898f-c73ba7c25222,69168234-1c5a-4612-89b9-22c298ed07ae,restaurante,2c7ea37b-4d02-4e1e-b35b-e5f3e3a6dcf2,Ipsam aspernatur reprehenderit sapiente facere.,2,2025-03-10 10:45:00
a6944cb5-8653-4eac-aa2d-1b7c4d34bafb,f3698570-1172-4be4-bd12-ad40c5cde377,orden,647223a9-d1f4-470c-8c1e-aef528c85aa7,Quidem ea quibusdam dolorem labore soluta aliquid.,1,2024-05-20 02:00:00
5bcd3718-38d4-42ec-91d6-4142ade2f63b,4d599e9b-fbc7-4088-9c99-f702377a5b91,orden,a7efd02c-473e-4717-9719-41cfaaed5205,Officiis possimus illo molestiae officiis numquam necessitatibus.,5,2024-08-17 00:15:00
2d739b6a-3235-40f8-81b0-1baf23c4c582,3d9fcecd-49ad-47fa-8b7e-3af12b1e7cfd,orden,6f35cb11-24b0-4353-8ea2-4db04bf75ab9,Optio laborum modi voluptatibus.,2,2025-04-08 12:15:00
b9e4ce8d-d114-4d2f-ba4a-7a0a2a064371,7de59582-d0e7-46f1-bacf-168e35e7add7,orden,d21b09f5-1d70-4d0b-bffe-11516097c26c,Nostrum itaque unde id veritatis nulla sint.,1,2024-11-18 16:30:00
80222d2b-4685-408b-ac59-30d79ff6f2c3,1cc2ebcb-ce3c-44dc-90bf-156ad85495be,orden,5419d682-fc58-41ae-970c-b64b2d5db6c2,Soluta tempore minus totam eius quasi rerum id.,2,2025-03-08 02:45:00
091db61f-b183-4803-a895-7ef4ed054c5e,37e475c4-268e-41d2-a709-c9da9e3240af,restaurante,db8d5b45-f1b3-459c-9098-c914d379cfee,Dicta cum possimus praesentium.,4,2024-07-06 13:30:00
63bf7536-094a-4788-9088-b1b5b320e570,96e385b5-44bc-4f75-9fb4-606cfe205873,restaurante,36f41145-494c-477f-87ca-1d095e20139b,Ut vel mollitia eligendi distinctio maiores.,5,2024-10-25 08:30:00
2efde48d-38b8-48e6-9f92-609ae6530a02,c188b912-2853-432e-96b2-6afae90ed408,orden,d04d3085-cf11-4a79-aee1-4537f48bb319,Maiores nihil voluptas autem veritatis itaque nam.,2,2024-11-18 10:15:00
9ce068cd-8c9a-48bd-88e6-301c751cdd91,5e339206-f9be-4117-bd18-4d80a25a1b23,restaurante,b82540f2-33aa-4b83-b268-711d7dc95a90,Odio ut sit praesentium.,1,2025-02-25 17:15:00
ebd33bc6-f78d-40e4-8e79-881ecbf3aeec,4eeee27e-3b67-4c83-8768-0be60360a338,orden,7c3b34b7-b38b-4e72-800d-0694c1131119,Et eius natus maiores.,5,2024-07-14 12:00:00
20196ebb-113e-4b71-bcdc-780f51cbf421,87bf87f6-1aab-48b9-9081-1d9acbf9e4ac,orden,723b0f42-181d-4308-96f9-277442052da0,Temporibus consectetur debitis autem nemo enim.,5,2025-03-14 00:30:00
ae41e637-ccbc-4b18-9343-b286755dc28b,ece24d7f-f3cc-43bd-825f-f375a4dba65f,orden,f2b0c2f3-3e8c-430b-964f-c2bd2d38c4fd,Eius laboriosam non odio.,5,2024-07-27 00:15:00
34aa9571-bc8b-4b33-8b47-f5274d761550,9ee070aa-f211-4084-be78-ca9f041cc7d1,orden,42a803f3-1308-4001-984d-e82c431fdf67,Doloremque ipsam temporibus aperiam odit.,4,2024-12-17 14:15:00
dba76d8a-8e8c-4d3c-ada2-25f9aba60196,295d8818-fe5a-40d6-b108-f123e715b74f,restaurante,b34f3dc0-51a7-481d-9eb9-0a22067a7e55,Officia dolorem nostrum ad quas suscipit laborum.,3,2024-11-29 09:30:00
15d6405e-e88e-4dd9-a65c-91bce268ea0a,67747616-0aea-4292-8edc-334f61cca217,restaurante,d87cc97a-2099-44bf-bfbb-5db97635b256,Molestias iure eaque tempore reiciendis ipsum amet.,2,2025-03-13 16:00:00
5099e1a8-f3ba-4c93-8b91-75c11695f17b,1072aa71-55db-48f7-98f5-f922ac8ffcdc,restaurante,c465d8c1-341c-4d3b-9c2a-d68672629c18,Enim beatae amet nobis at.,5,2024-12-27 22:30:00
4c4b950f-8d5c-4e97-8829-9b986bbcf380,5075f7de-b921-4b6f-9422-304ca0607b15,restaurante,893f29bf-5a5b-4899-a8c8-5149d45b4dde,Nam explicabo nulla fugiat dicta dolorum debitis.,5,2025-03-07 10:30:00
7129f34d-251b-4906-a728-ff4e666a9a03,15962fe0-b996-40ac-b21b-e22cf259d441,restaurante,a4bf20bc-a4f6-4fed-aa56-39af639b29ae,Aliquam perspiciatis porro aliquam libero dolor tempore ad.,2,2024-10-17 05:45:00
35a241eb-7e00-44c7-8a31-24b52249dced,11f3963d-0a9b-40aa-8134-f3414a4b1890,restaurante,3205ddaa-c2cb-4c1d-bd9f-a4ec2182438c,Saepe nam expedita sunt fuga numquam excepturi.,5,2025-02-27 04:00:00
3e7cbe04-d352-4e7d-8514-5fe8d00a16a7,11f3963d-0a9b-40aa-8134-f3414a4b1890,restaurante,b32d9948-5bf0-4fe3-89f9-bc65363085b3,Laudantium reiciendis illum quae.,5,2024-10-07 18:30:00
d2a895b0-32a6-48b5-9efe-95dbb2a5003c,28932f59-ceaa-48d6-af14-d48be861b8da,orden,51652e4b-c61d-4777-990a-b61bc34658cf,Saepe inventore enim eos incidunt.,3,2025-01-29 14:15:00
4da52cd2-eff7-4f8d-8d4d-2683f3865494,d7ecca77-12cf-49af-9178-bfb73002016e,restaurante,6b31ffff-9bae-4fec-bfc5-8ae50b00f890,Iusto voluptatum excepturi ut quaerat natus.,1,2025-01-29 18:15:00
e34b960c-2721-4b92-ac2c-52759cb1bd4a,46c18ecc-4db3-4f90-bf80-5f8eb10123eb,orden,57fac0bc-ef5a-4790-abdb-75e6a9d6b011,Delectus reprehenderit beatae qui laboriosam aliquid nemo.,3,2024-05-17 09:15:00
56aef9e6-0c42-4ba6-9d1e-e6edc0e106fd,42770909-9b94-47aa-a84f-831f28eaa8e4,restaurante,75465073-e5c6-4a98-ab01-24ea511bdd8f,Eius ad earum quas mollitia laudantium.,5,2024-11-28 08:00:00
65b69537-128a-4c99-8d69-05057880a5c3,0a685dc4-e975-4d54-a8ca-dde068140a80,restaurante,5f0d4b32-7387-4d57-ab0c-1277fe1c6711,Esse adipisci eum animi provident error id.,1,2024-10-02 04:45:00
