temp_id,reviewed_id,type,usuario_id,comentario,calificacion,fecha
a688665d-b40b-44b1-9bf4-9375293d6d43,dcf2d9a5-7f22-44bf-8228-97f57d38429f,restaurante,aa739a2b-1f45-4be6-a399-f7036ae29a66,Quo similique praesentium architecto natus natus.,1,2025-02-24 08:15:00
cb7df264-14f7-465b-9dd8-73a945195950,82d7c8de-31c5-45e8-bbdf-a4ba0ed0cda7,orden,48be63c7-8b79-4a6a-81ce-2f07fba9f4d6,Reprehenderit ad velit odio.,1,2025-02-11 12:30:00
4f4b34e9-f792-47ce-aaf1-3598562733e8,b3d3d5e6-8170-4366-95bc-6b08460e0985,restaurante,6f2f9846-44d4-4b73-85b3-76fe8ac5bc54,Exercitationem modi ad id.,1,2024-05-05 15:00:00
0e418840-20a5-4019-aa98-b20c3cbb7678,67747616-0aea-4292-8edc-334f61cca217,restaurante,f5a65958-d2a2-4da3-9551-125940bbdfa5,Mollitia nobis nemo tenetur enim labore optio.,2,2024-06-08 13:45:00
c2a5b297-6430-4157-95ac-a2cce9021e35,21e411f7-8085-4e90-8dae-49ff76430b9a,orden,5b989420-22dd-404e-8c57-452901df5a52,Magni soluta eos expedita veniam dolorem.,3,2025-02-27 21:45:00
2b31368c-d822-450f-b9e3-357f42032bd0,98f95958-438b-43da-96fd-65778c5c8c85,orden,8abb56d4-7d7a-41f3-8e91-62875b05b3de,Excepturi sed unde omnis dignissimos assumenda.,1,2024-08-23 03:00:00
5279d3d8-234f-48a6-b664-96b8f12ae276,290916d6-d527-40cf-9570-fbc1d7728931,orden,7ab72446-8b96-400b-9d9c-246bb56e751d,Accusantium ad sint quae voluptates nulla.,2,2024-05-22 19:30:00
11ab3a5e-b12f-42e8-90ca-ae56d133842c,c5d71192-0a62-4175-aff5-3a1b7266039c,restaurante,4f36529c-2f0f-4c43-8e4f-8a46db63d4e4,Eaque asperiores itaque dicta.,3,2024-11-16 21:45:00
dfe1cbec-de99-4851-8d0c-c60177efcbf3,ba7f9f7f-e2e1-42ac-9906-64ce7193ba5c,orden,cc0dd6de-4a1d-4dd4-a6e8-6f2bbc33cc39,Adipisci iure perferendis quo eum optio veritatis.,3,2025-01-20 18:45:00
43cdc736-d553-4bf5-83f4-05d9f92ab295,a4e9ca10-0513-4ba4-bbdd-ea7ccba2f046,orden,928820ff-8093-40d2-9a46-80bb396fccc5,Earum et sint.,2,2024-07-11 22:00:00
d2735a17-1a85-4405-846e-194df80efb40,611c4382-8d48-437c-a6ac-e498c0af769f,restaurante,5fe7327d-c68a-4a01-9b11-9467b2019976,A odit itaque et.,2,2024-10-02 19:45:00
25eab13c-314a-44ef-aaf1-5f44d0ba75ba,8bd0a4f0-d1ab-4bf5-986a-d3b69fff9642,orden,ab1c0e23-5e18-4944-a479-2232d7f6b513,Nostrum porro beatae illo.,5,2024-07-01 11:45:00
31ed80b9-441f-4518-b4cd-3b7797a07290,a3a258be-d186-450c-9916-c2cd9a00baab,orden,62d356ea-c932-456f-bebf-18f6e44f12f4,Distinctio ea eveniet similique sapiente rem.,2,2024-11-02 04:30:00
2916dcaa-130e-47e0-a4eb-a0ec28cdc7fb,8bd0a4f0-d1ab-4bf5-986a-d3b69fff9642,orden,19e81217-bf63-4a3e-909f-6596bb3be5cd,At ipsum quia quaerat quo placeat.,4,2024-12-15 23:45:00
4a0967f8-3d5d-4839-a1fe-e78ffeb2ec81,dcf2d9a5-7f22-44bf-8228-97f57d38429f,restaurante,61492150-e8ad-450e-b64f-c3a820f4fd83,Iste culpa necessitatibus odio deserunt.,4,2024-08-18 20:00:00
33446787-8ffb-49df-a801-705dd2905623,00467886-43c6-4cf5-bfac-69c237e40f72,orden,b9ad3c66-65b6-4af9-a6fd-8f4a720aa3dc,Repellat modi inventore voluptates.,4,2025-02-22 00:30:00
c989aa49-ea3d-40ce-a4a9-1d816701fd14,930bfe0d-32dd-4271-8d34-02740bc4b622,orden,8d43c819-14d3-4f40-805c-28dcbdee6eb3,Perferendis laudantium beatae eaque vel officia quod.,1,2024-09-16 03:15:00
dbd868ed-8b3a-4979-89c9-e424d88ff17c,e0500b40-c45a-4532-9c59-910b0f3d09c2,restaurante,684740d5-6961-4238-9681-d6a73eff026b,Eius ullam rerum fugiat tenetur dolorum.,5,2024-09-08 05:15:00
24e6313f-4e16-4121-98db-39b5dfaba86f,37eea789-2ea0-42e5-be9c-7afc80d5b1ad,orden,81f57c73-802c-4a4b-a5db-e477ebc2eb17,Suscipit quaerat delectus aspernatur.,3,2024-05-02 08:00:00
a1cdadb1-f6c8-431c-970e-2985b0af0a47,3c42b6d3-337f-422e-8d2d-53cc6167a8f1,orden,a78b9fbe-15d0-4ca2-bf7b-03e4e05e11d9,Sint voluptas sapiente quisquam placeat in amet.,3,2024-09-18 19:30:00
220de255-c480-44e3-aca7-175e08eb090d,fc28543b-6fae-4e80-8578-5b49e64d9919,orden,ac1f2235-9e93-4c37-ad08-0bc26035250c,Explicabo cum corporis molestias fugit.,3,2025-01-19 00:45:00
ffb37896-cf81-4cf2-a0ff-e488f3ed0554,3328fb1f-5340-4284-bc0d-55c3271dfa32,orden,5188e214-a309-4095-89e2-c204b8d122c8,Architecto aspernatur esse provident a.,3,2024-08-20 20:15:00
b368dec8-9147-49db-8f70-a981c4a4ee49,99755ee9-2c8b-4395-803d-22fcd16e93a0,orden,2eed1506-4598-4ffa-878e-1c61eec67287,In provident hic quos inventore.,5,2025-01-19 00:45:00
07cb7443-3657-4b46-bc53-dc1c7e1ebb06,10c514b2-b58a-4131-938f-1d1c90d7f9f8,restaurante,a7228e96-7f69-42e9-b8f1-287be8cba36b,Ab maiores provident qui.,2,2024-06-06 21:45:00
c78809ea-5048-4f8b-9699-7a9ff33e28bb,22609ad1-0ced-4e16-b63a-84e53b96a326,orden,817921fe-fb20-4a3b-b9db-4da3e43927a7,Nihil ab eveniet ad earum.,1,2024-12-26 21:15:00
91555e00-a270-4fb8-8a18-36e6e76cff2d,fd315413-4757-4f56-8c92-c321de95bf3e,restaurante,2f823b50-b554-4e50-8181-443d1d5dc489,Quasi dolore assumenda id labore.,5,2025-03-04 19:30:00
2a13a38e-55b7-4dec-8409-f0a0e5c3ef2e,b021924b-39c1-4757-bd24-c00a03a38659,restaurante,747667e3-794c-4e79-92d7-ec99bcb6085d,Reiciendis cum itaque labore vitae error pariatur blanditiis.,3,2025-03-25 16:00:00
9beb6558-e4c0-430b-bd6b-eeb592a95ce2,5074bb6e-cbf1-4e9c-9b2d-92243cdaa263,restaurante,15836147-0f2f-4652-bdda-f4c099229f39,Deleniti maiores sapiente ratione eos.,2,2024-09-11 23:45:00
b18a3b24-ecf8-4c11-b01d-fede86e9e8c3,79eaebd7-50c5-4fb1-9107-b6fe5d180a6b,restaurante,343169f8-0b06-4867-bcd7-1e1f8bca7349,Reiciendis laborum non et quasi.,4,2024-12-28 22:30:00
f6e9bd74-1fc6-4c7f-a022-6c525b81e9b4,69ffb74d-ac9c-469f-bddb-28e2af6fafd3,orden,6a3a87b2-32e9-4f7e-af61-7ec0eabe4cb6,Fugiat iste molestias amet voluptates fuga.,1,2025-03-08 19:45:00
e444b62b-1581-466f-99b8-4150843fbb63,9e1a5a3d-f513-43ff-bfbd-56682dbf3e25,orden,504dc355-6cdd-4351-9221-564a5c936f1e,Consequuntur praesentium repellendus quidem atque recusandae itaque.,2,2025-02-18 17:00:00
043a0c29-6348-483b-bbcd-dcfa4c027221,3d9ad0cd-faf9-44f1-a5d9-d8d9d3a50349,orden,fdec38f6-36d9-46b2-900d-170d200fea00,Cum ipsum aut exercitationem asperiores nobis suscipit odit.,4,2025-02-27 23:00:00
04d23e42-ab48-4118-8642-352ade5e1a6c,34820196-fe28-4f39-a473-50998960d2f3,orden,a746be9d-6cc9-4078-b65d-e267b0842bbb,Quo vero cum nostrum ad dolorum.,4,2024-10-20 16:00:00
34694abb-6c58-4878-b5b5-0db144f1f4ad,5e339206-f9be-4117-bd18-4d80a25a1b23,restaurante,714dc092-2922-4d28-9c60-53057088d51b,Corporis officia ad sapiente.,3,2024-09-19 19:15:00
bd87472d-e598-4fc3-9610-92ab2296598c,4d51e05f-8837-47d9-a445-ed5ad7725e0a,orden,7a2db564-01f3-417c-b3e0-3fee29a726bb,Vero quisquam voluptates fugit.,5,2025-04-08 20:00:00
dcdba6d9-2ac1-405e-a82e-efbd1dea65bf,cb5dc9fc-bbe1-4cb9-bfe8-74c0cf54acc0,orden,eedc5521-8209-48c8-8dca-d2745c7258d8,Amet quam ex dignissimos sapiente.,4,2024-05-18 10:00:00
b2c33b0d-cb14-4504-8cb9-c06241e65784,e810c581-0621-4d7e-a4f0-80095220ece3,orden,45c35f1b-d955-4299-91ec-a382d4e91b50,Laboriosam aut maxime et officia pariatur.,1,2025-03-07 23:15:00
a395e8f2-746c-4b07-bf85-0f9017b06f75,dcf2d9a5-7f22-44bf-8228-97f57d38429f,restaurante,8c197d8d-b6c7-4d96-b816-8173ac6e0753,Laborum mollitia doloremque.,3,2024-10-29 14:00:00
d2f9f7fc-531a-4973-8afe-533168619b50,2ff3dd4d-0fdd-48d5-9dc8-9c862f66d337,orden,1b33a13c-8589-4a2b-93b9-8be18373e31e,Ipsam optio blanditiis maiores consequuntur.,2,2025-03-29 14:00:00
59ef5c63-6b91-4bd1-b1a2-4587daa3a0bd,818bc7c4-4798-4b37-b922-4938426b7c9a,orden,497578fa-f6b3-44b3-b9d3-4dd7e557e9a8,Perspiciatis adipisci quis debitis itaque suscipit officiis.,4,2025-01-12 03:15:00
ba6d2833-5e9c-4bce-9526-a95799e33ae9,d7ecca77-12cf-49af-9178-bfb73002016e,restaurante,18590fb6-9141-4b9a-b317-bb36e3ee6966,Nisi natus rerum aliquam earum.,5,2024-12-15 15:00:00
4c0eed34-7e9e-494d-90cf-957ae53d446f,2e12b122-6b3f-4384-adb5-2bfc91ef5136,orden,87beab76-4584-409f-8afc-9c55f8559614,Nam soluta accusamus aspernatur iure ducimus praesentium soluta.,2,2024-12-25 15:45:00
d124f587-59ee-412d-937b-765cbef8723d,611c4382-8d48-437c-a6ac-e498c0af769f,restaurante,eedde5bd-db51-4af5-8f68-356d237fa9d8,Tenetur voluptatum ab nisi unde quidem.,1,2025-04-03 12:30:00
cda19a4f-c3c6-4706-ac84-151e1f021831,a674852a-a421-448d-bfb5-4b33c51cef37,restaurante,0a30964a-4bcc-47ca-82d3-11bdf1416515,Cum deserunt quidem vitae doloribus.,1,2024-05-24 14:15:00
a3e0ef19-ea15-429a-bb11-35528b18fe9d,15962fe0-b996-40ac-b21b-e22cf259d441,restaurante,723b0f42-181d-4308-96f9-277442052da0,Consequuntur explicabo quibusdam eius corrupti fugit.,4,2024-05-06 13:45:00
bd67db8c-1cf6-479d-9271-8a1be5490176,295d8818-fe5a-40d6-b108-f123e715b74f,restaurante,37cd8d99-92bd-4094-9ff3-ecd06f365e9b,Beatae repudiandae reprehenderit quaerat praesentium.,4,2024-10-25 14:45:00
313997b2-f6fd-49da-8493-f45271c46819,11f3963d-0a9b-40aa-8134-f3414a4b1890,restaurante,522b1239-9ec5-43e5-a562-330c064247bc,Voluptatibus distinctio minus illo omnis.,2,2025-01-25 00:45:00
55bcad46-cd4f-4155-a4ab-e63090d98696,d2acbb6b-b7c1-47e1-b882-09e699160329,orden,3b753c72-832d-4a31-bbe5-49cc3359e856,Perferendis delectus repudiandae nemo aliquid dolore.,3,2025-04-22 08:45:00
989d6aba-e119-4616-8928-04e105e5beb0,b5bf4a77-f5ed-47fb-a20f-6ff52ad3462b,restaurante,db596a91-473a-46a9-86d2-f92a94d3f232,Deserunt adipisci asperiores fugiat enim.,2,2025-04-06 21:00:00
e3707bc7-1fcf-40a7-bea1-502f6680cbe4,2d616741-9cca-4efa-9169-10f057f0c505,restaurante,d744961c-dfed-4f4a-a24b-e1ce396266dd,Harum mollitia itaque inventore.,2,2024-05-13 18:15:00
ae67ee5a-e051-4a54-a31f-d9c9e7ded788,57ed0621-15dd-4278-9ec3-56762dccf98c,orden,37072079-b8b7-4fdc-a6ce-48a186be3d5c,Aperiam molestiae officiis harum nemo accusamus excepturi.,5,2025-02-26 19:15:00
14ff441b-39af-442f-a9ec-61573c14e5a7,28896222-253a-4fcf-be66-91d10e115421,orden,ffb62868-eba2-4276-ac39-5e0582974d26,Eum quaerat voluptatibus modi.,2,2024-05-10 06:45:00
e27f4757-e711-4778-a679-0975c00a1d6d,569e31d1-f70e-47c6-90ac-97e1d9fe91ae,orden,e6647397-fb06-407f-af50-cf936196561e,Quos reprehenderit eius.,2,2024-09-10 10:45:00
848cf415-1d77-4f5c-b550-08db951c4785,3f34acc4-9bee-4a3f-838c-2c68ccbbd23b,orden,365872ce-ccf1-4ead-b5d1-29cdd4b27d61,Quam quaerat accusantium minus repellat alias accusamus.,3,2025-04-08 18:30:00
931a886c-5c25-4449-b53b-20589dea0a6a,2a5f067a-9360-47e9-8167-0fba51547b3e,orden,28af4415-82b6-4f05-ae9d-4394cbeaa631,Odio vero sint excepturi unde.,2,2024-11-14 11:00:00
8ffad259-7284-4760-ae83-38d41ddd8142,fa9892fa-f13c-4cd3-8dec-ec745cb2eac5,restaurante,dc80c35e-025b-42e6-9784-fb2e7d3a48ff,Possimus officia doloremque facere vel perspiciatis.,3,2025-02-09 05:15:00
8f579e7a-0357-44d7-a786-44ad87f58f95,e104b148-6483-449f-812d-b5974acde608,orden,f78aa2da-b067-4190-b81a-d0b1a0f4fd46,Ea asperiores quo mollitia vel numquam consequuntur.,3,2025-04-02 19:00:00
77c572e4-5f89-498c-aa92-05dd4abaa611,636c52cd-523d-427d-841e-bb71f8c8c3a4,orden,8c2ece27-4dcc-4c0b-ba47-6623ac7f5c5c,Id excepturi dolor ab.,3,2024-11-15 12:00:00
3b5a591a-fbb5-48b5-beec-6f594a9afde4,0072a4b0-fa05-47c1-9875-c958d65fc0d5,orden,dfc006f5-1dd8-4ee5-acc7-d98398c3138f,Sequi iusto perferendis veritatis.,5,2024-07-18 02:30:00
5a868935-ea31-4178-9ab5-e7925cbe6880,79eaebd7-50c5-4fb1-9107-b6fe5d180a6b,restaurante,2f823b50-b554-4e50-8181-443d1d5dc489,Ut hic deserunt corporis consequatur rerum.,4,2025-04-15 07:00:00
a6f0f179-f44b-4363-8019-73a2e317b86a,3328fb1f-5340-4284-bc0d-55c3271dfa32,orden,dca1c617-acd6-4aa9-acfb-6c4f7ba87800,Velit tempora repellat temporibus ipsam rerum tenetur error.,2,2024-05-10 11:00:00
e3c1e9f9-6b9e-4be3-8b32-720db087baf5,d1e2c593-83ed-4295-a802-1652515d99be,orden,a746be9d-6cc9-4078-b65d-e267b0842bbb,Deserunt provident ducimus asperiores deserunt ratione repudiandae.,4,2024-12-17 18:00:00
a083d2e7-c575-4604-a0fa-282513a0a1ee,4621a4c8-96d0-4190-8049-f3ae88b0f58e,orden,f72c6b52-fb66-48a4-9fae-f2ffc88d737a,Consectetur fugiat accusamus architecto.,1,2025-03-14 01:45:00
d4c7dbfe-436d-4a73-894a-83a1bbc87849,11f3963d-0a9b-40aa-8134-f3414a4b1890,restaurante,57fac0bc-ef5a-4790-abdb-75e6a9d6b011,Error officiis reiciendis.,5,2024-09-22 18:00:00
945c38aa-6956-4d9a-a83b-3545ef05351d,10c514b2-b58a-4131-938f-1d1c90d7f9f8,restaurante,5ba5b699-a4ea-4a3d-af3f-04498968d161,Corporis temporibus reprehenderit illum.,2,2024-06-22 04:30:00
479c1e28-f6ca-4e5e-b268-8e12930b2a1f,ea7d6ccd-9587-4601-9afa-2f768013be3c,orden,986602fc-e198-466a-b6b1-eaba0458e88d,Veniam fugit aliquid.,4,2024-12-30 19:00:00
7ce15f42-d685-4038-9ed4-21b23b00e99d,5e339206-f9be-4117-bd18-4d80a25a1b23,restaurante,b0e68e40-09d2-44f3-9ae7-d48b4536d635,Est suscipit voluptates sequi.,4,2025-04-09 08:30:00
4757cd0e-9573-4672-80cd-5ce81c5d1f80,67747616-0aea-4292-8edc-334f61cca217,restaurante,2ec7fc37-ec74-4ac9-82cd-e25b9b5e15cc,Laudantium harum nisi a iste porro.,3,2025-02-18 06:45:00
17cb08f5-c1e9-4a93-9018-cca5dcd8a873,b021924b-39c1-4757-bd24-c00a03a38659,restaurante,2c605dc7-edea-49b9-ab73-21e070697323,Nihil amet a atque repudiandae repellendus consequatur.,4,2024-05-05 00:45:00
e0f687bd-3688-4b52-b5ee-1dab874fc621,37e475c4-268e-41d2-a709-c9da9e3240af,restaurante,030d6691-bc09-44fc-958b-afa47ce20859,Maiores quae esse pariatur delectus.,1,2024-08-12 05:30:00
5ad612bc-612b-436a-bb74-e2d49748eb11,7e7da564-9f8e-4506-97ec-d50006ff3d90,restaurante,5891f413-3d5d-42b9-ad74-62a4538816dc,Sint pariatur quae inventore voluptas dolore.,1,2024-07-26 17:15:00
c96a48a5-f887-4cf2-bebc-d3678f89d0c7,611c4382-8d48-437c-a6ac-e498c0af769f,restaurante,d4dabdee-a705-4cf2-ac18-4b63e01aa039,Quidem provident autem labore sit.,4,2024-06-25 00:00:00
0830fe27-cdfa-4193-baae-d6cc3c508a45,3958a64a-3648-4024-9f4a-2105f11ca9ba,restaurante,b5ab7129-4e5a-457b-abea-fba75e363684,Non officia veniam asperiores voluptatibus.,3,2025-03-29 03:00:00
38f5c10d-006d-4872-9a7e-cfac1321b45f,d7ecca77-12cf-49af-9178-bfb73002016e,restaurante,a44730e5-d284-4a09-95a6-15c8e6a39be4,Non accusamus voluptatem necessitatibus voluptate quasi.,2,2024-11-27 11:45:00
278e39ba-77ac-4744-912c-fd288644a24c,a674852a-a421-448d-bfb5-4b33c51cef37,restaurante,5366b222-a299-47cb-a8a2-05c541e7dfe1,Ipsa saepe repellat.,4,2025-02-01 08:00:00
b882200a-64a4-4b56-bfc1-8fd948786c61,b021924b-39c1-4757-bd24-c00a03a38659,restaurante,343169f8-0b06-4867-bcd7-1e1f8bca7349,Praesentium est iusto quaerat sint.,3,2025-01-11 07:45:00
a878fd0b-5a23-43f2-942e-c9061caf5d40,7b00f6b1-6c36-4bfc-900a-e63a4a80437d,restaurante,f0285574-2241-4267-92a5-c29bfe9e7a0d,Eius eius officiis saepe sed accusantium aliquid.,5,2025-02-27 21:45:00
780fcab4-e378-4ed4-b255-131899eeb8fc,2d616741-9cca-4efa-9169-10f057f0c505,restaurante,54288b46-462f-44eb-8a39-39399c8925b7,Ea est rem earum tempore.,3,2025-02-21 05:00:00
b1513ae7-6a1d-41be-8adc-90b4ff0fca4c,05566c7a-5a25-4ab6-ac08-3c75e3bc66d0,orden,64295097-809d-4227-95ed-7745fed34315,Illo in accusamus nihil.,5,2024-06-02 09:45:00
f176b9a7-f7fa-42c8-ba86-ff05bd1bf42c,9a08bff3-1cfb-4b10-933d-980c5623b5af,restaurante,12b16872-5fb3-4546-9091-e4b68895aaae,Corporis veritatis ducimus praesentium quae mollitia eos.,4,2024-09-17 19:45:00
b2f27769-a45a-4c07-b587-bf5f70e1c9ed,e26c5ace-9bc7-4c4a-ae1f-f6970bb85c3d,orden,27ae4599-8349-4216-bff7-30501e61fd98,Incidunt architecto deleniti dolorem temporibus.,4,2024-05-21 01:15:00
38dbebd2-9b63-4af0-8070-8cf4c161808b,e0500b40-c45a-4532-9c59-910b0f3d09c2,restaurante,e8b5103b-2c3b-4ac8-9718-ad9a3fe0457f,Impedit eaque omnis numquam necessitatibus nihil aut.,1,2025-03-25 18:15:00
b50d7de2-fbf5-4dec-abca-8eac6738f0cb,9b2bb396-e37b-4978-84cb-c5fe9672f04b,orden,ea8be471-c49c-420d-afb9-a24724097927,Ipsum ut dolore ex consectetur inventore.,3,2024-09-17 00:45:00
e98654d2-3678-4d9e-bf3e-d932cb819010,b5a90add-f997-4dad-9333-3b893e24c281,restaurante,b0e4ac64-e5bf-493f-8310-8598a01504a9,Voluptatem nisi dignissimos sequi.,5,2024-11-27 03:45:00
e6dfcaa9-4e14-4131-ba27-34db05c00059,2d616741-9cca-4efa-9169-10f057f0c505,restaurante,24479815-4433-40d3-b78e-5dad4f124935,Iure libero quos numquam itaque.,4,2024-12-13 21:45:00
18a4dcd8-9198-4881-b3d3-c6cd516c46fd,3e2db0f3-1e69-4217-a589-434cbc5c7de9,orden,28e2f741-7878-4cc8-bf30-0959b577dcc3,Nisi nulla eveniet consectetur beatae distinctio aliquid.,1,2024-12-04 22:45:00
1cd5e4dc-d5bc-4c7c-9903-f16e8198e2bd,2db485ca-41ea-464f-9098-7e307654cca1,orden,74de3f5e-1668-456f-b661-02945d8f3743,Soluta dolorum a commodi minus.,1,2024-09-08 04:45:00
fea4c80d-18df-4a6a-89f1-8fb7cbd61f69,506c9214-a9b9-4348-89a2-0d3d9051442f,orden,c465d8c1-341c-4d3b-9c2a-d68672629c18,Autem at quia reiciendis quod.,1,2025-03-28 23:15:00
7a64ec71-efaa-4b92-88fe-c855e4f48c31,2db485ca-41ea-464f-9098-7e307654cca1,orden,e023a66c-9fc8-4d0c-ac32-19cdd48ca956,Odio repellat nisi excepturi repellendus officiis quasi.,5,2025-02-21 18:15:00
88a87053-6938-409d-817a-cc6d585bbe8d,3ab39999-93c7-4478-8f6b-a2beaedf2829,orden,030d6691-bc09-44fc-958b-afa47ce20859,Reiciendis a ullam temporibus nostrum asperiores.,3,2024-05-08 10:45:00
b90f7254-dbcc-4961-b17e-d452c9c7f09e,e51418e9-547d-4c03-a185-22fd24f46c93,orden,9f620f5c-246e-45c7-882a-00cdf8fe0d69,Iusto dignissimos laudantium id quidem.,1,2024-10-25 16:00:00
435c0822-f8cc-4767-bd97-a29c573613a7,7e7da564-9f8e-4506-97ec-d50006ff3d90,restaurante,0937f295-8717-400d-9020-778dd1b151b8,Illum exercitationem labore maiores excepturi earum quis nulla.,1,2025-02-03 23:00:00
2570c893-74b5-4ef4-8091-b6f43761d4ef,4621a4c8-96d0-4190-8049-f3ae88b0f58e,orden,698279f2-e565-488d-a23e-ee0104273cde,Aspernatur libero facere incidunt sint odio.,1,2024-10-05 00:45:00
f7214fd4-9219-40a0-b622-184c645f72d0,583d2574-f690-48c8-9a67-fff4a130116d,orden,67f89785-195f-4539-9f1b-9835d86d28dc,Voluptate neque eligendi sed.,3,2024-09-02 15:00:00
f59f2951-6d3e-4053-bfc6-98aa73bf7888,d17bf44f-80ef-4fc1-966b-7d403d3a165d,orden,d7b9d8ba-04fd-4652-98cd-e2e3b4cd54eb,Assumenda nihil minima odio doloribus nisi.,5,2024-11-15 00:45:00
ff87aa08-10f1-429f-90c1-b34031edc22f,fd315413-4757-4f56-8c92-c321de95bf3e,restaurante,bdc3416c-ac0f-4b01-8264-8348ec9a0bd7,Quod esse molestias eaque libero adipisci voluptas quaerat.,1,2024-08-16 03:15:00
acdf1ea8-5a05-49ff-9b37-1ea2dd4b123f,a674852a-a421-448d-bfb5-4b33c51cef37,restaurante,71bfa0c9-6c56-4519-80f2-2442c47ee913,Distinctio nulla quis quo ratione mollitia ipsam.,2,2024-09-20 12:45:00
13b9bcea-0111-4f5d-90cd-70e630d0106a,9e1b0f7c-d376-400b-b3fa-f594dd6c4e9a,restaurante,f548e754-049d-415b-9cf9-187e238c207c,Maiores soluta neque aperiam fugiat dicta.,4,2025-04-09 13:30:00
e08955a0-73ed-45cd-b907-f8c88ab4308f,2b9f50b4-8e67-4b9f-bcd7-ccb2c2917157,orden,c820d47c-576d-4b79-a7ab-03309f47640d,Ab labore quaerat nobis.,4,2025-02-20 01:45:00
5c27e842-f3a0-45a1-8b0a-6a18d19caa26,776f40b0-844f-48c7-b288-7eb65b4b6e29,orden,a4d18911-a5f7-490a-b7ad-76720e0d36f3,Veniam provident dicta facere.,5,2025-03-16 02:15:00
a7b29af1-299d-471c-9324-974a94cd172b,10c514b2-b58a-4131-938f-1d1c90d7f9f8,restaurante,2bd8fcc5-a7ea-47f6-a450-61f8059ba78a,Veniam quas adipisci ab cupiditate eveniet ipsam.,1,2025-04-09 17:15:00
2eeba870-2959-45d4-9e11-81ca56bbbd36,fa29b0cc-dff5-41c7-ade5-e8009bb8fee2,orden,34b7edd5-25e6-4df7-a7c9-dd8831669f03,Quis eligendi fugiat dicta veniam veritatis quibusdam.,3,2024-06-22 14:15:00
42391996-54bb-4147-aec7-e100da27e46a,b01dab35-0546-4d17-8084-5675d717f6bf,orden,a9fd6962-d8bd-4341-ae20-a3b8fe2efc9c,Dolore tempora possimus occaecati expedita doloremque.,3,2024-05-14 14:00:00
84f08640-3304-4703-95d9-85349bfdd823,ccb4d862-7d21-4dd9-b026-c5864c777910,orden,d70fab76-1506-41ac-9ccd-197d4e82a736,Delectus quam officiis at nulla fuga.,3,2024-11-12 16:15:00
a90a393d-cc57-4e76-951f-a2bded159c77,c5d71192-0a62-4175-aff5-3a1b7266039c,restaurante,bb25ad6f-be39-461b-8a29-a6e5e3717037,Quasi vel architecto veniam dolorum.,1,2024-06-01 10:45:00
b3ac9ef3-8ba9-4ede-8339-d31deafed5a9,a674852a-a421-448d-bfb5-4b33c51cef37,restaurante,51f4dde6-5c3b-4601-a152-785736d70145,Aspernatur recusandae repellendus repellat porro deleniti sit tempora.,5,2025-03-22 15:15:00
ba68b516-b3b8-41d6-9e52-2237a2d094e1,f13c97f7-d77d-4db6-9839-df242e8db15d,orden,b0e68e40-09d2-44f3-9ae7-d48b4536d635,Dolores in laborum at iste eos.,5,2024-11-23 04:15:00
d7e64f83-908b-477d-b7a2-dc038d13cc2e,fa63e89d-964f-48b3-960b-8b53aca8a6bb,orden,111476ef-a77c-4908-8ed4-b843b7d898ed,Laudantium ut ea nisi quisquam iure.,4,2024-11-29 02:45:00
324fc96c-7b0a-4557-b90b-98a65886baf2,295d8818-fe5a-40d6-b108-f123e715b74f,restaurante,900de4f1-0639-4efa-aae4-a1342a6299af,Quia optio corporis dicta pariatur quaerat ex.,3,2024-07-04 22:30:00
a6e15726-afa5-4bda-aff4-fa8219788a10,cf824ba9-3921-4ad3-829f-1272f7c20b0e,orden,3069a6f6-40c5-426b-bcd9-11270b180ad0,Repellendus autem possimus saepe culpa alias culpa.,1,2024-06-24 13:00:00
2f603944-9141-43c5-8fc3-052207c1d898,453c587a-094e-43f9-b300-b121149f2e16,restaurante,90fdc21b-98aa-41b1-aba9-83f2f3380963,Vero modi accusantium minus consequuntur iure laboriosam.,3,2024-08-06 01:30:00
c9026418-ec6b-41c9-ac8d-911fceff87f1,c41ec4c5-bf01-440d-b11b-8e991f3d7e97,orden,f3e969e5-6a06-4581-aca8-cef50a256d83,Quasi sapiente accusantium debitis modi velit.,3,2025-04-16 00:15:00
768b4c11-f4ae-4ed6-a214-5790c69f2166,5e31ee67-dac8-4f04-a717-e42fbb7e9f38,orden,b6095f8c-4154-47a1-8771-09b497a1eb8f,Ea inventore est deleniti recusandae vel ducimus.,4,2024-12-25 00:45:00
99816745-832e-4c72-a529-dbb2c3a990b5,aab32494-1042-4330-a37a-52f073a5325b,orden,0d30bf70-2ead-4442-bf27-4140fcd5b6ad,Dignissimos dolores ratione exercitationem debitis.,5,2025-02-28 01:15:00
9a16ed14-4671-48d5-92af-5218d8e659e9,9a08bff3-1cfb-4b10-933d-980c5623b5af,restaurante,9fb5445e-1c19-4c05-a82c-6aeb130eeea9,Sit at tenetur porro quo ipsam.,4,2025-02-14 16:30:00
16074844-484b-41f0-81d3-7f4b200f964c,7e7da564-9f8e-4506-97ec-d50006ff3d90,restaurante,7d209538-831e-4608-ae37-85ebae181379,Consectetur sint delectus iusto ea rerum ipsum.,4,2024-07-21 05:15:00
76a6080d-5bd5-4c93-8ad5-9296ff5fd323,0e5d3ee4-1c2a-4b04-a2dd-52f9359da119,orden,5366b222-a299-47cb-a8a2-05c541e7dfe1,Officia nihil dolor adipisci.,1,2024-10-31 21:30:00
2b953cc9-010f-41f4-8bcd-ffd4d8934581,5e31ee67-dac8-4f04-a717-e42fbb7e9f38,orden,36d91dd8-b739-4983-bbe7-4c54a9b6134b,Aliquid corporis eveniet commodi ut adipisci excepturi.,4,2025-04-19 10:45:00
57fd96cd-5d5f-4721-a3d7-f9c566a09b73,9e1b0f7c-d376-400b-b3fa-f594dd6c4e9a,restaurante,1dc360fd-831b-4169-a7f0-65384fc55afb,Nemo ut rerum in quibusdam minima sint.,4,2024-09-18 21:15:00
1d1ad933-0faa-4271-b38a-776ba4f623ad,aec3571d-62e6-4d0c-900a-efcfbe37b6f0,restaurante,c723d220-7409-4ef2-a89d-c871021ff9ea,Eaque totam enim blanditiis blanditiis placeat vitae.,2,2024-11-04 20:00:00
b6431c03-e8b0-42f4-92fc-242bfee0afcb,9200ffe7-b8c9-45e9-a54d-39947078c305,orden,5562dfd8-5138-42e5-8d97-46f266e59b74,Similique iste cumque voluptate reprehenderit cupiditate.,1,2025-02-02 12:00:00
dabb9275-d8a8-4881-bffb-8e3506760efd,f9ea3da0-b081-4d15-8f74-a3a05d23c7ec,orden,5313241a-0c9f-4c5e-8858-4a3b6f39a88e,Assumenda veniam ullam saepe ex.,3,2024-05-15 22:00:00
0697111a-e9fe-4ac7-a7c5-7e21cc22a18b,e26c5ace-9bc7-4c4a-ae1f-f6970bb85c3d,orden,1c5a4a33-4b6c-440e-90e0-63fad6727c2d,Nulla soluta deserunt tempora.,4,2024-10-22 19:00:00
0d78e0d0-b503-4b73-bcfe-d26bd32e57e9,788b0c80-070d-4b24-bfde-3491eee7c36a,orden,a33c31b3-3cf0-48b8-8300-f8890d8d367c,Cumque amet non assumenda.,4,2024-12-27 00:45:00
0110ce92-e02e-4057-b0e2-d7802f558e75,778053c7-63c3-4936-9622-b450acb84e6d,orden,4fb1e1fc-b19d-4dc4-afc9-d2a182dfdb40,Commodi reprehenderit iure.,5,2024-08-12 13:00:00
50b007a6-f841-4742-9d6b-329676a0f903,818bc7c4-4798-4b37-b922-4938426b7c9a,orden,c5849872-a8fc-45bf-955a-0e1ae52d0473,Voluptates corporis consectetur minima.,5,2024-06-05 20:30:00
86210b10-62b6-4d29-a18a-0d630cfb4f47,30d58810-0630-4421-bed0-00c28b28ee9d,orden,714dc092-2922-4d28-9c60-53057088d51b,Laborum provident repellat vero ipsa maxime facilis.,4,2025-04-03 07:45:00
0a2b1d55-68eb-41e7-97e3-a32218268172,3aff2541-3857-4cce-8c7d-fde9f4a5e535,orden,9300470f-a19b-4b8d-9fb4-fcce8d61bc3c,Suscipit reprehenderit beatae exercitationem ipsam deleniti laborum.,1,2024-11-24 00:00:00
04049bbc-59dc-4ebe-ac73-ecc4c91c3ac1,b5bf4a77-f5ed-47fb-a20f-6ff52ad3462b,restaurante,2f402980-2e32-424a-9f75-8095c4f81d3d,Recusandae consequatur adipisci sequi.,4,2024-11-07 22:30:00
a4d08ae2-d7a0-4a60-a9de-532840ead0a4,9915eca4-6eb0-4f0c-9daa-38fd9edb8f89,orden,3ae89991-208c-4167-98e3-4671d3673274,Enim molestias quas expedita.,2,2024-12-01 04:15:00
d4484824-5456-4e61-b657-73a9af19521e,efe3a217-a047-4f3b-84c6-9db71a88c847,restaurante,9fa8a33e-d9eb-42bc-b1eb-9e504bf9fa54,Assumenda amet eius eius qui iusto adipisci.,4,2024-06-24 20:00:00
3e8d3052-d80b-450a-8e1d-397d88e9501b,a0f34524-764d-449b-8483-ad7351c2a7b6,orden,467ac0c4-17c8-422a-9165-6ef50768b970,Ad sit ipsum omnis.,5,2024-05-30 07:00:00
c079314d-3d07-4bfb-bac2-2fded056c2a5,ea1568ca-bb91-40d5-94f6-29bc2e3c6cfd,restaurante,e779246c-d7f8-4809-97eb-d851a296f039,Excepturi dolor atque repellendus dolores.,3,2024-08-22 14:45:00
4100c20a-041a-4137-b775-82d4ca153655,b5a90add-f997-4dad-9333-3b893e24c281,restaurante,d5b76736-244a-4d37-915e-ddf5289605dd,Nisi magni architecto delectus.,1,2024-11-16 02:15:00
3ac891ca-31ea-41cd-a506-f5202cbe2784,efe3a217-a047-4f3b-84c6-9db71a88c847,restaurante,5b8176a5-4ad5-4dfb-9073-16c8aaac608a,Commodi architecto quos exercitationem cupiditate rerum.,3,2024-06-14 10:45:00
d534929b-b2ee-408e-8933-1a54caf38c76,5e339206-f9be-4117-bd18-4d80a25a1b23,restaurante,dc869758-6fc0-4091-ad10-2ae2a090de02,Porro totam sapiente dicta culpa sunt dicta voluptatem.,3,2024-06-08 05:30:00
311dd3ed-0b54-4e13-84f8-af060b87e051,7408a4e2-93d8-4149-8e97-f58d1a04b9c4,restaurante,de2e3d8c-e780-4f27-b243-dfa022d7ea1c,Pariatur corrupti atque voluptates eaque quo eius.,2,2024-09-06 21:30:00
c8e83732-8c00-4864-9627-5f83b8716a40,a200a349-eafc-42e7-91d9-d50d49f95175,orden,7b39914c-381a-4b97-90c9-766c6b66be83,Debitis molestiae aperiam beatae quam modi.,1,2024-05-16 07:00:00
80571648-825f-44fe-87a9-38ba74b33be8,83babf86-bc2d-4977-99a4-ae328dc903d3,orden,17ac8d95-04c9-41db-a262-73d7897fe91e,Optio neque mollitia optio corporis est exercitationem.,5,2024-10-17 09:45:00
01e48e74-e51f-47ba-b1b5-47bf21458f54,5075f7de-b921-4b6f-9422-304ca0607b15,restaurante,d00a1d6f-6799-47ed-a214-c4a623556346,Nobis ullam inventore ipsa quam in minus.,5,2025-01-19 02:00:00
