temp_id,reviewed_id,type,usuario_id,comentario,calificacion,fecha
bc80f334-d084-4cbe-829a-47a812fd7a2b,d7ecca77-12cf-49af-9178-bfb73002016e,restaurante,68237a6f-4fa3-4ea5-9d26-11051afa0384,Fuga blanditiis reprehenderit repudiandae tenetur pariatur.,1,2025-03-25 17:30:00
cf43358f-b183-4f42-9518-afe68e11f8d1,42770909-9b94-47aa-a84f-831f28eaa8e4,restaurante,6425ceb2-52dc-4f45-995d-e4a857b6402b,Quae nihil odit.,2,2024-10-25 10:15:00
f7c28230-97f1-4d17-b244-2b1e9be1c48b,aec3571d-62e6-4d0c-900a-efcfbe37b6f0,restaurante,17bd7264-d196-4fee-bf10-8c9f565e921c,Possimus fugit modi praesentium sit asperiores.,1,2024-11-02 23:15:00
755f2be3-5688-4ba0-b7c1-326eeb6a4b0c,39507950-b2b7-4cd3-854d-f06cec011a20,restaurante,ac6d07cd-7685-4d20-a4e5-c73f9490ec6a,Tempora maiores voluptatum similique.,2,2024-06-25 16:45:00
e6d47bf4-e09d-4fe6-a9cc-c8bbd6a54b0a,dca72228-d0be-4469-9c98-46165957fe8b,orden,be8e725c-01fa-46ba-9953-bd69c233ba05,Ea tenetur minima tempore perferendis.,2,2024-11-09 14:30:00
39175b82-f38f-46da-b249-c862abda57a4,2d616741-9cca-4efa-9169-10f057f0c505,restaurante,cec8e702-20c4-4a7c-97b9-91e6dd1aadef,Minus illo iste nam soluta voluptate magnam itaque.,3,2024-08-27 03:45:00
23b80939-7b9f-4f1d-a401-0d807e9f12cd,4166a582-dfe0-4bdb-908a-cf3b2c359d8a,orden,3dff0970-670e-4caa-99c6-f501eef5d22d,Perspiciatis esse quibusdam quaerat aspernatur.,1,2024-08-22 22:00:00
26f07fc3-b670-4690-83d6-4dff32bf71e8,301c73f0-0add-4b6e-a34a-0bde774bf741,orden,d744961c-dfed-4f4a-a24b-e1ce396266dd,Pariatur mollitia ut corrupti magni quaerat.,2,2025-02-15 19:30:00
e68c23ce-ab12-4918-bce2-daa94f54b989,d2b409b8-e05e-4c2d-a0a4-8f3a819a2a86,restaurante,15dee954-4527-41a9-940a-2663f0ad9ac3,Tenetur ex distinctio saepe.,2,2025-04-02 16:30:00
849817b2-2505-4111-8b3b-65a763c7d2df,f97c94d9-f87c-49a8-bbdb-06ce4cc1d9bd,restaurante,991d8248-91b3-436d-a1ba-707e6283fe68,Eum dicta distinctio aspernatur nihil eveniet repellat nisi.,2,2025-01-23 15:00:00
ec009203-51ff-40f6-9f19-49cf13a331b6,7d579295-4621-42fd-8ce6-44d7ac0204ca,orden,6108de37-7531-43fb-969b-141888859355,Molestias rem cum aspernatur enim libero.,2,2025-01-01 16:45:00
d41625f8-e76a-4bbd-b1c3-c136248c6e83,5ebcd335-d48d-4726-8d52-e4f834f65068,orden,9facdb1b-0c04-4c22-9c17-d1663050c193,Libero tempora autem quam officiis quo amet.,3,2025-04-15 05:30:00
a01ae54e-3571-429b-8038-6975c9e5d299,aec3571d-62e6-4d0c-900a-efcfbe37b6f0,restaurante,698279f2-e565-488d-a23e-ee0104273cde,Corrupti quibusdam corrupti totam culpa eveniet cumque aperiam.,3,2025-01-09 22:45:00
b30fe7c6-eff8-4b3d-8752-b055eaa6b906,4f3f1d3d-4209-43c8-a6ca-b00efed2a12f,orden,574adbed-5024-40d4-928b-2f87a510c8d2,Ea reiciendis rerum laudantium omnis quia quia.,5,2024-11-17 10:00:00
b8fa2225-6e60-461c-8fa0-63261c5353c4,fd315413-4757-4f56-8c92-c321de95bf3e,restaurante,f11483fc-e276-41ff-b407-1c73cdbbef2c,Laudantium aut nostrum inventore vitae.,3,2024-11-13 04:15:00
85f3bf24-0051-4558-b56d-c923831a26a4,5ce3c659-c24a-45f5-b8b1-51729b2116c6,orden,e0655f96-a42c-41d7-9b72-a86a5f37c8bf,Ab amet molestias quis quidem fuga.,2,2024-11-29 13:30:00
82728c0c-f08b-4d34-abfa-aab7f306d794,9df9a8e3-b92b-442a-8292-6bb6a6d57900,orden,c38eb291-55c8-40c5-8ec3-a91627c5ff74,Labore rem facere distinctio cumque eius natus.,1,2024-11-03 07:00:00
98c5310b-7cdf-444c-9b7a-be5bd202517c,6b6f0d59-d92f-44b6-a33c-d879ce23b1c8,orden,d744961c-dfed-4f4a-a24b-e1ce396266dd,Magni beatae autem.,4,2024-07-04 22:00:00
cbc39d5d-d9af-4f6a-ada4-39cdcb6b91bd,197a38c1-7b8d-458d-8541-5b5ee7fd885b,orden,5baa767c-2767-4dcc-9b32-b2c1bde175b1,Officia explicabo harum perspiciatis doloremque ad nesciunt.,5,2024-12-13 10:00:00
ef4c4b93-f54f-4821-84dd-f6d8bc3e4c9a,fa29b0cc-dff5-41c7-ade5-e8009bb8fee2,orden,863aff4b-fd5d-4514-9c56-ed3964655887,Porro ducimus ipsum sit.,1,2024-06-15 07:00:00
2a539b5d-335a-45df-9346-cb9311da08e4,7e7da564-9f8e-4506-97ec-d50006ff3d90,restaurante,3205ddaa-c2cb-4c1d-bd9f-a4ec2182438c,Sequi deleniti ipsam fugit provident odio illo ad.,4,2025-03-26 00:15:00
52d5b6e3-e951-48fa-be9f-717220459a22,7c63812b-ced7-4efb-ac18-868376ca61be,orden,b0e68e40-09d2-44f3-9ae7-d48b4536d635,Doloribus quae numquam itaque.,4,2024-11-07 22:30:00
9e97d7c3-58d7-4025-93b8-084bf8097eb1,b29e1a37-6889-4660-8ff1-cb4223cddbf2,orden,def594b7-d401-42e7-9f73-0317811d9438,Explicabo autem facilis soluta incidunt nisi.,2,2024-05-07 23:15:00
4b0a3210-4f17-4638-ac97-b33cecf1b0e4,9915eca4-6eb0-4f0c-9daa-38fd9edb8f89,orden,e764d250-46fd-4afc-984c-27349d60cfbf,Perspiciatis at cupiditate hic perspiciatis.,1,2024-12-22 14:15:00
dc6fc123-c75c-4690-9049-406abf485562,6350ef4f-c247-4b14-abff-2d1954ba0096,orden,48be63c7-8b79-4a6a-81ce-2f07fba9f4d6,Rerum quaerat delectus inventore dolorum.,2,2024-08-04 06:30:00
5aa67044-895f-4004-b80c-be9044a3a354,f70b64c7-05c9-4d52-bcb6-278398c52633,orden,cd2fd29c-5faf-4852-8180-9a469cc45773,Molestias eligendi ab iure dolore.,3,2025-01-13 02:15:00
97fcf29b-7b96-44d9-84d4-4d734c25d5fa,2868b2c8-3288-47e8-ac20-bbff92acdeec,restaurante,981b3b16-7185-4cb7-86ca-4368b20f5965,Dolorum explicabo in nobis itaque omnis corporis.,1,2024-05-13 05:30:00
cc8ccc72-58d9-42c6-96ea-78a4eff6c721,5aff442c-5168-4d0a-b122-98f097bd4484,orden,7c3b34b7-b38b-4e72-800d-0694c1131119,Nostrum consectetur perspiciatis harum repudiandae iure.,5,2024-12-01 08:45:00
a7c9f464-362f-492e-a17a-36ffa2600ede,42987de4-3591-406f-a345-0844e1e0ad36,orden,06ab9d11-4380-43a4-bec9-28f32eff2ce2,Hic omnis illum itaque incidunt consequuntur.,5,2025-04-08 18:15:00
63683399-5215-4a75-9787-c4751bab0f7a,7408a4e2-93d8-4149-8e97-f58d1a04b9c4,restaurante,7d2aa15a-e397-448b-902b-0edda41df943,Harum ex error maxime commodi.,2,2024-12-25 07:45:00
561726d8-7a30-4ba0-9bef-00aa0e2f096c,5074bb6e-cbf1-4e9c-9b2d-92243cdaa263,restaurante,7854173c-a087-4097-983e-baa4ad647454,Distinctio soluta maiores beatae expedita.,4,2025-04-05 21:30:00
37ff0ba0-bd26-4c25-bd22-dcb8246d4e16,fd315413-4757-4f56-8c92-c321de95bf3e,restaurante,31d6d3c7-908e-45b2-9052-e50d40e0a515,Molestias incidunt at quas vel aliquam suscipit quae.,2,2025-03-08 08:45:00
bfc865d6-1f35-4347-983b-a6e9c28dbe00,7cf6f4e3-3cc0-4c0b-9fe7-edf277f53606,restaurante,b01c2d28-2cec-487a-900c-c98111f98fd3,Consequuntur illo reiciendis maiores cumque.,5,2025-04-26 14:30:00
b59425d4-ea5d-4eaf-9291-1048e4ded9ce,984cea87-609f-4369-a073-3329ed171e22,orden,3ae89991-208c-4167-98e3-4671d3673274,Ut explicabo expedita corrupti non.,5,2025-02-26 11:15:00
db23a929-dadc-4972-a89c-c2086c35bbfb,d4b0fafe-2a11-4643-b4e2-5cbf3fe4a1a8,orden,3053a38e-8c30-4c5d-a382-a26324bccfbf,Beatae suscipit neque architecto sunt.,2,2024-10-28 11:45:00
11b66bda-2497-447c-9123-116d7bd5856a,b5bf4a77-f5ed-47fb-a20f-6ff52ad3462b,restaurante,76fd6867-3054-4fbc-be06-8bc07ae1918e,Labore consectetur aliquam cupiditate.,1,2024-08-23 02:00:00
743e520a-4f38-4515-a039-e450f0791321,67747616-0aea-4292-8edc-334f61cca217,restaurante,89069f40-a0f1-456c-90a3-ff4a510728e3,Suscipit voluptates blanditiis quis commodi consectetur laudantium tenetur.,4,2024-05-29 10:30:00
b0bea0a3-698b-40ad-b5f3-e42ab82d6a7d,3d9fcecd-49ad-47fa-8b7e-3af12b1e7cfd,orden,2e003ba0-e57b-42df-94d6-9cc37ded35ae,Repellendus eligendi voluptatibus cumque architecto nemo.,1,2025-03-15 11:15:00
be6575cb-614e-4eb9-a126-0bfbf5fc6d79,576c5fe7-62f9-4a20-8a88-e428af0f15ba,orden,9f620f5c-246e-45c7-882a-00cdf8fe0d69,Esse optio velit cupiditate temporibus reprehenderit quisquam.,4,2025-03-29 09:30:00
913a7c51-ffb4-4b03-9669-0ad27654a556,545bee97-6a2f-4ce8-b6d7-fc5fec76bc3e,orden,18125ae8-5cb5-4052-bc33-259a74f9e2f7,Ipsam adipisci aperiam expedita nihil ex suscipit soluta.,2,2025-03-04 02:45:00
6e4c6288-014d-4d18-bbc8-799439b37a29,7ef48c3c-d898-45a6-910d-14e0fe6490c5,orden,6f2f9846-44d4-4b73-85b3-76fe8ac5bc54,Tempora in in sunt sunt quo adipisci.,4,2025-01-02 19:30:00
fc36e1e9-f53b-412e-9091-4a768f430b0c,2ff3dd4d-0fdd-48d5-9dc8-9c862f66d337,orden,325fb2bf-d27a-4d4c-ab2b-5d3bf0387b79,Aut eius possimus odit quo.,2,2025-01-27 07:00:00
a93a8f74-ad7b-4902-ac7b-34f247f1dd9e,3712bf1f-7de0-429d-8ba3-e62b4abe1513,orden,87beab76-4584-409f-8afc-9c55f8559614,Impedit delectus doloribus veritatis reprehenderit quasi.,4,2025-03-22 14:30:00
f99533df-e305-4c34-bd98-0419324586cb,356db916-7241-4da4-8419-a310f5ce4665,orden,d7b9d8ba-04fd-4652-98cd-e2e3b4cd54eb,Consequuntur illum illo dignissimos aliquid.,3,2024-11-17 07:30:00
aa00b121-3ab3-44c1-8622-769b7acece70,79eaebd7-50c5-4fb1-9107-b6fe5d180a6b,restaurante,1113d36b-17ac-446d-b388-82cca91dff8e,Ea accusamus non porro voluptas nostrum.,1,2025-04-11 14:00:00
45c408c9-bcb1-41d1-a934-7951bfea4d7e,b3d3d5e6-8170-4366-95bc-6b08460e0985,restaurante,3164b671-09b7-46a0-946a-5f71fd62832d,Illo officiis natus nulla.,4,2025-01-17 16:30:00
068a9345-6bf2-4546-89b1-05fe467a4d21,2198767c-c235-480c-99e8-231e5bd24546,orden,e1e63a80-4cae-4455-a76e-29ee3e8072cb,Ullam eveniet eveniet deserunt ipsam aperiam veniam amet.,2,2024-06-09 05:15:00
e39bbb0e-48fb-4f1a-a8b1-f121a9190c99,199ba9b6-14a0-4509-81f2-1beb46fc09da,orden,ecca5d81-9402-4b4e-afc6-01bb7401a24a,Iusto repudiandae impedit omnis reprehenderit perferendis.,5,2024-06-17 00:45:00
4b4a98b2-03df-4e3e-8041-636833f29c26,f660b8a4-129e-428f-9a50-aa989ec6fd01,orden,23e2c02f-11f9-458f-b97c-55d5c40b28ff,Aspernatur excepturi ratione perspiciatis.,4,2024-08-04 04:30:00
44e7b0fe-6777-4e01-82c2-68fe620d06b2,5074bb6e-cbf1-4e9c-9b2d-92243cdaa263,restaurante,bdb776da-d2c9-42a5-a51c-ac12fe63dd49,Modi odio harum.,5,2025-03-29 10:15:00
f47c20cc-151a-4920-a8f7-7df187f19868,f97c94d9-f87c-49a8-bbdb-06ce4cc1d9bd,restaurante,65758706-5fc8-40ad-8485-e2229407c5bc,Tenetur magni recusandae officia ex incidunt.,3,2024-08-27 16:45:00
d5d8f220-dde1-49f7-82ca-88284bebd386,10c514b2-b58a-4131-938f-1d1c90d7f9f8,restaurante,b218eb57-fc4e-4342-87e6-a9dff0e09b1c,Odit est repellat eaque doloremque dignissimos atque omnis.,5,2024-07-15 20:45:00
6b41d67c-e306-4867-8886-c6f5b980b5a1,c5d71192-0a62-4175-aff5-3a1b7266039c,restaurante,67319e1d-f7b9-41de-b4e9-0ff8495cf35b,Porro debitis earum molestiae reprehenderit.,5,2024-06-18 12:15:00
0091e33e-9f09-454f-97c0-059b824dfddd,efe3a217-a047-4f3b-84c6-9db71a88c847,restaurante,e048bbb3-14b9-453a-aafb-29213e4e9803,Nobis placeat natus cumque.,5,2025-01-06 17:30:00
f00587e8-2cdf-4fc7-ac5b-d3fb2cdbb4f8,6e6ae2d7-8356-4f53-93ff-023ce15ddc29,orden,01640635-b5c9-4db5-8917-92ab090f0f31,Cumque molestiae fugit aperiam ducimus quae ad.,4,2024-05-09 22:00:00
c89a55e1-3700-4e57-ad72-76902d138efc,db137620-89fd-4c0d-a769-e13af247518b,orden,0ae5a260-65b3-4217-9dc8-046559d9be2d,Natus dolore at molestias natus ducimus nulla.,4,2025-02-27 12:45:00
49baca0a-e6a8-4bf1-bedb-eaa60eef5528,755ac881-cb70-48a9-9422-9bf6320d1b61,orden,723b0f42-181d-4308-96f9-277442052da0,Asperiores ducimus maxime repudiandae fuga saepe.,4,2024-12-15 00:30:00
9cce415e-821a-4401-9dca-aa316b2a149a,dcf2d9a5-7f22-44bf-8228-97f57d38429f,restaurante,47543d99-cba5-4be8-b943-21cfa695e85a,Corporis quisquam dolore nam nisi fugiat animi ad.,2,2024-05-10 12:45:00
3b6f26f0-59ec-4f2a-84c4-d5786af4a539,d8bd3f24-2654-4548-ab54-34d921f8fa5c,orden,497578fa-f6b3-44b3-b9d3-4dd7e557e9a8,Harum officiis amet saepe saepe magni provident.,3,2024-06-30 00:30:00
e8059e8a-7a9a-485e-a275-bd690617babc,9e1b0f7c-d376-400b-b3fa-f594dd6c4e9a,restaurante,bd0496f9-4117-4caf-ae26-9c147147122d,Magni ex neque debitis vero voluptatibus tempora.,2,2024-06-20 15:00:00
8b2689f2-5b66-49eb-809a-83bd180b89ba,a1edcd7b-eb85-4ed3-b91d-c8a1c2412f1c,orden,fd646d08-4e3d-4d54-9122-1b1712fff27b,Repellat animi facilis ex asperiores sunt optio.,1,2024-11-08 19:30:00
92345878-eb83-45d7-b98b-4c585c3c675e,aec3571d-62e6-4d0c-900a-efcfbe37b6f0,restaurante,60a93beb-ca3a-4318-aae6-ed84f7eb830c,Voluptate vero error earum ut tempora voluptatem.,5,2024-12-31 13:45:00
e5ade3c4-442d-428f-a530-066067d3b034,6e6ae2d7-8356-4f53-93ff-023ce15ddc29,orden,38214059-3a2d-4e64-a731-985ad9f01c1f,Et ex facilis amet laudantium.,5,2024-10-22 08:30:00
b4f3e266-d45f-4b4f-b19b-53a67c1b5b70,d3f5ba7d-a2ed-4e02-94ba-c35b76877ef8,restaurante,207737ca-6a8b-4c01-acdf-ffb01294dc85,Aliquam delectus architecto porro maiores.,4,2025-01-07 21:45:00
2df2a64c-5c1a-4321-9bb0-ffa7aecd1100,02f5c98e-53fe-4edd-9051-1f0ab6408f46,orden,7871d049-fdda-4866-b2b1-dc8c222d54b6,Molestiae debitis expedita soluta temporibus dicta.,3,2024-10-31 04:30:00
6078483e-d1f1-407b-8fbf-b7f8ccd75a6a,421d3a8c-32e3-4352-87cd-1e48c2520a4c,restaurante,92973aca-e06a-48b1-bcce-0750f6541cbb,Incidunt inventore similique nihil impedit.,5,2025-04-06 02:15:00
0d40bd3e-bc88-465e-8ecf-ea9bf2ef0055,5833744d-b72d-416f-a256-dfa7943c431b,orden,f8d13cc1-70f7-456e-9bb4-56b904624a88,Assumenda cumque sapiente dolorem.,3,2024-06-27 20:15:00
8154184e-4e05-4e8c-99da-15588235f8e3,611c4382-8d48-437c-a6ac-e498c0af769f,restaurante,624f85d5-2ccf-45fa-9d24-1a52ba6962ad,Explicabo velit repellendus delectus iste animi dicta consequatur.,5,2024-05-13 16:45:00
6587ef33-9015-4a0c-8e51-3a22392d9c7a,546afa7e-ebac-4c9e-b298-becf456c3c3e,restaurante,e0655f96-a42c-41d7-9b72-a86a5f37c8bf,Minus culpa impedit hic.,3,2024-05-08 14:00:00
9f94c917-df21-4895-9727-32cd6a12a9e4,0c3b70b4-4184-4d07-8edc-c69f2c3c6119,orden,f181b21f-8f52-4a4d-9356-4104254d584c,Quis occaecati excepturi ab maiores quod.,5,2024-11-23 15:15:00
8a4fb46f-206a-40c4-9e46-b83b7abe204d,01bb61c1-c313-48e0-8b6f-115b551a7242,restaurante,23e2c02f-11f9-458f-b97c-55d5c40b28ff,Esse quibusdam rem repellendus dolore consectetur iure.,3,2025-04-25 04:15:00
9cfe8dbb-7620-4444-851b-9409dccbb8a1,d3f5ba7d-a2ed-4e02-94ba-c35b76877ef8,restaurante,f9e1979a-d5d5-4b09-9c9a-7a0425762efd,Natus odit laboriosam non aperiam cum nam.,3,2024-07-21 05:00:00
27996b8b-32fe-479e-b0d6-4df06c46a572,d2b409b8-e05e-4c2d-a0a4-8f3a819a2a86,restaurante,70b8d5b3-4066-4289-a53c-7e62786330e6,Sit inventore assumenda velit beatae commodi.,1,2024-06-26 16:45:00
bb2ffb64-e30b-4525-ac57-ab991076e065,e0500b40-c45a-4532-9c59-910b0f3d09c2,restaurante,1c5ef168-805d-404e-9b63-c0fb0e9b944e,Alias neque quasi deserunt sed labore.,1,2024-07-07 17:15:00
c47849e8-574c-4cf1-b046-1417a204f590,453c587a-094e-43f9-b300-b121149f2e16,restaurante,5313241a-0c9f-4c5e-8858-4a3b6f39a88e,Voluptatum illum commodi delectus eaque quasi.,1,2024-12-25 00:15:00
e5001fed-e093-4f20-9e08-305c11b4cf77,cef2e817-d62e-46c1-9e39-ac5c2a02b874,orden,c23d3187-ac94-4dd0-b0c3-7d0453907433,Illo ex laborum dolorum exercitationem.,5,2025-03-31 20:15:00
7b6fa651-532a-4ee9-9af2-fbdaa6906a7c,e6e9c831-4130-41e8-a89c-ca7f2ace92bd,restaurante,ca5b548f-b0fa-4d41-b90f-cb08f21e9a7f,Consequatur atque veniam quod sed.,5,2024-12-16 15:15:00
8158aa2a-0132-49a7-a2a0-9709a7cbca87,97805341-6f3d-4c99-813b-94da786285f5,orden,eb7c0496-b40a-4a5e-8376-6f3128fc0c6f,Esse velit illo nihil commodi.,2,2024-11-16 09:45:00
3e674743-430a-4382-9862-2daff18b67a8,9e1b0f7c-d376-400b-b3fa-f594dd6c4e9a,restaurante,a69fba7c-efd4-4b7f-94ca-731556d42703,Delectus odit voluptatum architecto at.,3,2025-02-21 18:00:00
8ebba546-e76e-4b90-a3f6-48ddb9c5a8c9,18fad4da-8f11-4936-ab29-5cd55871a724,orden,813cf319-368b-4a5e-a51d-908312188498,Eius sed dolorum culpa dolores illum aliquid natus.,3,2024-06-01 10:30:00
9ff27916-dd41-4acf-a54c-fc0025d13d6e,339c3c2d-e95d-4ed1-9bf6-080511ccc6df,orden,49841557-71e6-4e1f-9c80-f734e6e9895f,Fugiat recusandae dignissimos maiores cupiditate nisi.,1,2024-11-13 23:30:00
7cb1cd23-723c-4e3d-b821-54567a91aba9,ea1568ca-bb91-40d5-94f6-29bc2e3c6cfd,restaurante,31d6d3c7-908e-45b2-9052-e50d40e0a515,Itaque eum commodi.,2,2024-11-19 03:15:00
be532be7-6555-4865-bfcc-cf45d8061853,79eaebd7-50c5-4fb1-9107-b6fe5d180a6b,restaurante,376ba77f-b46a-40fc-a0a7-d8a8306b9236,Facilis corporis rem molestias cum voluptatem.,1,2024-11-08 19:30:00
7fc9359a-57c2-4076-906c-0e2164f78d67,dcf2d9a5-7f22-44bf-8228-97f57d38429f,restaurante,59d01e33-b2de-48c1-8ee8-d702f34e18d5,Ut itaque repellendus eaque architecto.,2,2024-09-24 02:45:00
8c03b426-9ac4-4839-9c71-ddd63409a117,4c606925-0445-44ae-8271-5d0e76f24e13,orden,5edae461-a3ee-4da9-b008-99ba6fcd51d6,Pariatur repellendus earum animi.,5,2024-05-07 12:45:00
f2625ab6-c6ae-4c29-8cba-90990a0d0e46,42770909-9b94-47aa-a84f-831f28eaa8e4,restaurante,96494e53-2057-4c3d-bcb9-ec2f105b0995,Repellat soluta repudiandae.,1,2024-06-10 00:00:00
e789d930-6644-416d-997b-ffdcf5bfbffe,984cea87-609f-4369-a073-3329ed171e22,orden,18d5b99c-44db-44a8-bb27-b0377c144f0a,Asperiores atque temporibus eligendi suscipit accusantium accusantium.,4,2024-12-15 22:00:00
de621b77-6d68-445c-bbdf-01b88074656e,4df675d1-81a8-49e6-9f60-b5932491d330,orden,abf3ac80-e533-40af-be5d-4fe752de2954,Repellat ea omnis.,2,2024-09-24 04:30:00
a1498923-864a-423b-b8a5-a5ccb2063998,4f3f1d3d-4209-43c8-a6ca-b00efed2a12f,orden,477b31cf-7840-416d-aa7c-fcc85cb1e6e8,Nulla assumenda vero labore natus magnam quia ratione.,1,2024-07-29 08:45:00
7e0b4d21-c03b-4724-819b-8da134e7468d,869d3253-54ef-4582-8ff3-9eb198b7aada,orden,fcf93a88-465c-4ca5-a26a-ce2a07b06f58,Fugiat placeat ducimus inventore sapiente.,5,2024-10-10 09:15:00
8108c25c-ef13-4386-aa2e-51876c6c6399,5075f7de-b921-4b6f-9422-304ca0607b15,restaurante,c5849872-a8fc-45bf-955a-0e1ae52d0473,Praesentium id neque soluta.,5,2024-09-10 19:15:00
9b109f51-12bb-4f15-9ffb-3ddaaeb1a832,b021924b-39c1-4757-bd24-c00a03a38659,restaurante,5da5d94b-25e9-414b-938c-affd72aa0c91,Architecto doloremque veniam repudiandae autem ex.,1,2024-08-13 17:15:00
fe777efd-6d88-4bc8-b64d-e998d8bf4533,3958a64a-3648-4024-9f4a-2105f11ca9ba,restaurante,a746be9d-6cc9-4078-b65d-e267b0842bbb,Ipsum quasi laudantium blanditiis.,1,2025-01-23 23:30:00
902bdb7b-5bc5-4e14-a368-4119ccf77ba4,c5107180-ba1d-49a4-a52c-7e299946f57e,orden,78232ef0-110d-407f-8334-1e78ffc861c4,Perspiciatis natus tempore officia molestiae assumenda animi.,1,2024-08-13 07:00:00
8b5b5316-bbbf-48fa-9074-8a5790b75334,480cfd4d-dac3-4769-b933-add5f9f269ff,orden,da33492f-f031-42b9-9f37-28d6f9b050de,Veniam corporis officiis quidem esse.,4,2024-08-06 08:00:00
f7d8b43f-e201-4cf1-a3fe-5d86e7d266c0,d3f5ba7d-a2ed-4e02-94ba-c35b76877ef8,restaurante,817921fe-fb20-4a3b-b9db-4da3e43927a7,Ea quidem fugit minima explicabo.,1,2024-07-18 13:00:00
8a1428c8-b16c-49f1-859b-d65eda8d9e3e,9177a2a9-fdc7-4702-a7b0-ee172a76d32e,orden,8f34e87b-f7e0-469c-b09a-845739953983,Cum quaerat eveniet minima voluptates maxime fugiat dolorem.,2,2025-02-18 15:15:00
16b0ec05-b27c-4601-b5fb-5098e7337d75,5b988584-6b36-4257-820d-4f8115bb985e,orden,fcc2eb06-ec91-4915-873f-693d17746a5f,Eum alias omnis tempora in dicta laborum.,4,2024-10-10 05:00:00
f9efbb6a-2e3a-4074-bf24-0df1ccb78198,58790434-50cf-4882-b313-abd4c92f586b,orden,b0a23509-13df-4398-bd36-373d37f57018,Maiores veniam illo a pariatur.,4,2025-02-21 17:15:00
1a75fd31-dc07-4a60-802a-23b44940cf44,ea1568ca-bb91-40d5-94f6-29bc2e3c6cfd,restaurante,4ab5161a-8355-4f51-acfa-7356f7ab15ee,Explicabo aliquam accusamus officiis totam esse.,1,2025-04-12 23:45:00
461f0532-3e94-48f3-a5db-cea8df688573,82d7c8de-31c5-45e8-bbdf-a4ba0ed0cda7,orden,72dfc058-c9d2-42e4-be3a-f9e1ea139197,Illo unde quisquam animi.,2,2025-04-25 15:15:00
b2af3368-7994-4bbd-ab48-e37e7723f0b1,67747616-0aea-4292-8edc-334f61cca217,restaurante,c723d220-7409-4ef2-a89d-c871021ff9ea,Fugit occaecati nobis dignissimos fugiat.,4,2024-10-17 20:00:00
44eb6b39-542b-4f9f-9939-281cb83ca164,9a08bff3-1cfb-4b10-933d-980c5623b5af,restaurante,55fc36db-c4f7-41e7-b23f-6e3d278cf5a2,Quasi explicabo optio esse sit aliquid reprehenderit.,4,2024-06-25 06:15:00
476ef004-e45f-4a28-9f2f-87fb4283b995,5dfd81fb-cd68-439f-9ab9-6ef099b0a94f,orden,dab0fd79-9938-4dc3-bb3c-d52307117814,Amet est labore minus maiores.,5,2024-06-17 11:30:00
66e29249-e161-4143-a272-17bb3740438d,17bda07a-d31d-45db-ac09-6ac6f2effc40,orden,2e003ba0-e57b-42df-94d6-9cc37ded35ae,Amet cumque eligendi et architecto amet ea.,4,2024-06-22 21:00:00
6c80c225-a257-4453-b1ce-e3d57caff54e,05bfeff7-e96a-4ba4-a972-7c651d001c71,orden,bae0409c-a3a1-4cd9-af73-b38acf48f353,A iusto ea adipisci temporibus.,1,2024-12-29 10:15:00
83d76682-4da1-45fa-9fa6-a68647460966,9e1b0f7c-d376-400b-b3fa-f594dd6c4e9a,restaurante,37808cf2-50cf-4363-b16a-4ed61abcfff7,Eius perspiciatis voluptas fugit consequuntur nulla necessitatibus.,3,2024-11-26 14:15:00
df45dadc-aa39-435f-923d-485c75dc7b8f,b0c4e358-a58a-4be1-b561-f19c7d4ff8c8,orden,b82e2a14-01bc-4a44-affc-cd8488f33543,Ipsum cum incidunt minima esse unde.,2,2024-11-28 10:15:00
14562cdd-8064-4592-9302-a54fa1f3d107,b5a90add-f997-4dad-9333-3b893e24c281,restaurante,57fac0bc-ef5a-4790-abdb-75e6a9d6b011,Voluptate quo nulla non.,3,2024-11-13 03:15:00
b592f540-aa53-4956-84f8-ea04b12f655e,f97c94d9-f87c-49a8-bbdb-06ce4cc1d9bd,restaurante,b15f837f-c4eb-4c0e-9cdb-830cc9a32526,Iste dolorum quam temporibus non officiis sapiente quasi.,5,2025-04-03 11:30:00
6e030156-9daa-499e-ba2f-4a3e8a7281ae,d3f5ba7d-a2ed-4e02-94ba-c35b76877ef8,restaurante,7d740fe1-faf7-474c-86b2-d440268d42ce,Quos nihil corporis incidunt veritatis laudantium.,5,2024-09-26 14:00:00
6950193a-7c18-4a53-94b5-9a852821f6bf,7045b51f-71e1-4195-b97f-3f967d092cab,orden,d04d3085-cf11-4a79-aee1-4537f48bb319,Fugit quaerat officiis.,1,2024-06-14 08:15:00
0f8ced7a-9f08-450b-b975-f3867801e402,d2b409b8-e05e-4c2d-a0a4-8f3a819a2a86,restaurante,a9fd6962-d8bd-4341-ae20-a3b8fe2efc9c,Unde et error quidem aperiam molestiae voluptas.,2,2025-03-31 14:00:00
3e0c260c-8db8-4169-b26a-f5ef0afb3190,bd5f026b-64b6-4536-ac61-55e10e2b7aa4,orden,1b33c08d-006e-4da0-b4d3-e8fe97ad8be5,Excepturi labore deserunt voluptas autem ratione sequi.,1,2024-09-01 02:00:00
f7b0bf95-5800-4b0f-82a6-7fb7acdabe4d,d2d607c9-8407-45c2-8084-a0635e77a847,orden,59d01e33-b2de-48c1-8ee8-d702f34e18d5,Velit quibusdam sint dolor enim ut.,4,2024-11-07 04:15:00
d06b14dc-f421-4694-9935-f55c1f4101e4,2868b2c8-3288-47e8-ac20-bbff92acdeec,restaurante,cc0dd6de-4a1d-4dd4-a6e8-6f2bbc33cc39,Rem explicabo delectus tempore.,5,2025-03-31 14:00:00
665e59c7-dc20-496c-8b0e-527b67a7604a,9915eca4-6eb0-4f0c-9daa-38fd9edb8f89,orden,57a88942-ac06-43db-9d5a-a6dafab7a1b4,Deleniti veritatis similique exercitationem exercitationem magni.,3,2024-07-25 04:00:00
b0447844-71ba-4e60-95b8-5d43c3677348,83babf86-bc2d-4977-99a4-ae328dc903d3,orden,d8df5c36-d57e-41dd-a43e-16863b4271a3,Eveniet suscipit consectetur repudiandae corporis consectetur.,1,2024-06-03 07:15:00
0cefa096-fa02-48ab-a3a7-c6f24001f1ea,2c3c749d-509d-4eb1-9d7c-fa26b7bd1c33,orden,c6509eb5-d63a-40bd-8cac-514645f3e2d6,Reiciendis aut quibusdam omnis.,3,2024-08-04 22:15:00
924a3e64-70bf-4e72-846c-5a76db110f78,5ce774f5-3abd-4185-9256-9a9021d7ac55,orden,daaa9c5b-1bf6-44f1-8928-65b16796bb11,Sapiente occaecati excepturi velit repellat.,2,2025-03-24 23:45:00
1ae8fc35-493a-441c-9543-faff2bb252b2,90c1f239-95e0-499e-a655-9281489895ba,orden,ce999ab1-1fa3-4808-8724-99c742b25224,Esse distinctio ab accusantium.,3,2024-06-05 13:00:00
024e58e8-ea61-489f-8736-c0a43de61826,fa29b0cc-dff5-41c7-ade5-e8009bb8fee2,orden,981b3b16-7185-4cb7-86ca-4368b20f5965,Expedita harum doloremque ratione sunt beatae ex sint.,4,2024-06-20 20:45:00
3852a956-b555-4268-9ae0-86da2c9af99c,2747be73-3b33-436a-b5a0-f58af220486a,orden,4b216a7a-8adc-4208-942d-088c79f103d1,Culpa doloremque doloribus.,5,2024-08-22 23:15:00
2dbaf1d1-f0a9-46a0-b0b9-045641766633,4f3923d0-b9cc-44e0-8730-7f2d77f007fb,orden,84ea7107-0820-44be-809c-e13e3516e535,Odit occaecati modi eaque laborum enim repellat ipsa.,4,2024-11-29 23:15:00
948edd2b-25a7-4bb5-b307-3b93e2fe31b3,6725c306-ae74-4330-a8d2-aeda3cc3f094,orden,60bff64c-3043-4207-89df-0588d439f499,Velit rem perspiciatis esse.,5,2024-10-13 16:30:00
c18f2a6b-231c-4d74-9f51-8555d12e7258,b5bf4a77-f5ed-47fb-a20f-6ff52ad3462b,restaurante,ce6e6fa0-0265-4d0e-99cc-32622c34c4e0,Dolorem ipsum recusandae impedit delectus impedit modi.,5,2024-07-13 20:30:00
51e631c3-e6f7-418e-94a1-f63139ad6b57,453c587a-094e-43f9-b300-b121149f2e16,restaurante,fb82a6ae-6c04-49da-9887-0fbe922c9f2a,Repellendus nisi dignissimos facilis.,3,2024-06-20 07:30:00
458b5a82-7b57-4017-9a78-e7380ef0c75a,7408a4e2-93d8-4149-8e97-f58d1a04b9c4,restaurante,0ae5a260-65b3-4217-9dc8-046559d9be2d,Ut iste corporis ut itaque cumque voluptas perspiciatis.,2,2024-09-03 16:30:00
bee20106-5c1c-4376-81e4-75e0cdb1e1be,fd92b64c-731e-40cc-9c31-56e5e98c5c63,orden,2907575f-6334-4d03-8ba7-744e4651b933,Repellat eum adipisci.,3,2024-07-25 12:15:00
c78f5190-8456-42d2-ba3b-2f99deaa8ac2,641b1db8-0ff4-4f56-a98d-5976b3311992,restaurante,1b11dd95-9e04-4800-a711-34c73cb00ed2,Magni aliquid consequuntur repellat alias.,4,2025-04-12 06:15:00
d67aaa6e-7d88-4a6c-8d16-3b1537d94bcf,9d734990-9c63-40da-bbf1-b5894fea2360,orden,f04ab974-d909-437e-b71d-f012645f78ba,Tempora veniam incidunt reprehenderit.,4,2024-06-24 12:30:00
2a10b885-0c93-4b2a-8a68-6519aaac82f3,ea1568ca-bb91-40d5-94f6-29bc2e3c6cfd,restaurante,48be63c7-8b79-4a6a-81ce-2f07fba9f4d6,Non omnis animi magni.,1,2024-07-17 06:30:00
2356019d-1d0c-496f-b1df-3e85a43f9be2,7cac6c98-a4c7-47af-8b76-9ba3f56f0349,orden,5891f413-3d5d-42b9-ad74-62a4538816dc,Ab sed necessitatibus hic error dolore sint.,4,2025-04-03 07:30:00
338c2a27-89bf-4af9-bd22-ab932d53b4e7,ea1568ca-bb91-40d5-94f6-29bc2e3c6cfd,restaurante,519c6235-12da-46f8-a2a0-23192edc51f6,Reiciendis beatae ad sed.,5,2025-01-30 08:30:00
30bbf14d-bffa-4e6f-be73-93ae7a510e27,aec3571d-62e6-4d0c-900a-efcfbe37b6f0,restaurante,24cbc91e-26ce-4118-9615-630cbeef9a9f,Mollitia blanditiis optio at.,5,2024-08-21 01:45:00
7eac7694-2fd1-4be7-a1cf-8443012c960d,79a4cf00-0012-42d4-9464-3f9b213583c9,orden,45c35f1b-d955-4299-91ec-a382d4e91b50,Voluptas est debitis possimus voluptas magni neque.,5,2024-10-12 01:15:00
9bb764c3-2488-407f-a948-35c70fe7813b,d2b409b8-e05e-4c2d-a0a4-8f3a819a2a86,restaurante,0f2cd6b6-2e65-4527-804d-4c1abe09fcb7,Recusandae voluptatem qui dolores itaque.,5,2025-04-11 18:15:00
6293ee22-a08f-4cba-9488-4a566ea69d01,17e87a3f-259a-4101-9a57-e1769e346d4e,orden,acc44ee7-0f72-4e8b-b6f9-dbf5cb80b67d,Optio vitae dignissimos velit nihil tenetur.,3,2025-01-29 23:30:00
92be267c-199d-4199-bb96-e616ed0ccb8d,9a08bff3-1cfb-4b10-933d-980c5623b5af,restaurante,6174a1e0-4a7c-4224-9cea-6a7ffbfe18ea,Excepturi laudantium quis atque.,3,2024-06-04 03:00:00
6bcc8337-53f3-4b74-852f-f9135864f5a4,39507950-b2b7-4cd3-854d-f06cec011a20,restaurante,ecf11b72-d07b-46fb-96dc-69d45c055f94,Autem hic doloribus autem cum debitis dolor quas.,1,2024-09-11 13:15:00
