temp_id,reviewed_id,type,usuario_id,comentario,calificacion,fecha
b7a622d9-ea59-4f01-8629-70edf48743f0,ad78fda4-3a7a-496e-8404-925b7df1f8a8,orden,38575289-029a-407c-ad59-b610356b8d81,Ducimus voluptate at quos laborum pariatur.,5,2024-12-03 22:45:00
61869560-4596-4314-859f-e0e1e3360970,f4c56bc2-dc28-4e2b-93a6-188cbb07b899,orden,b82540f2-33aa-4b83-b268-711d7dc95a90,Iure veniam magnam expedita blanditiis architecto iure facere.,5,2024-12-29 02:15:00
1a425cbe-71ff-4ba8-b023-e923d1c25b26,c6c37925-4175-4720-b498-c492ca294f80,orden,aa739a2b-1f45-4be6-a399-f7036ae29a66,Totam quam ab beatae cupiditate dolores non.,2,2025-04-09 23:00:00
d902280b-6755-44a1-9c76-fa9554da4dc9,4b4ff2e1-bae8-4735-894c-099d3e362887,orden,dab0fd79-9938-4dc3-bb3c-d52307117814,Ea nobis quae dolore similique commodi.,3,2025-03-01 10:30:00
1321e43d-140c-44ad-83c4-52471891bc31,1072aa71-55db-48f7-98f5-f922ac8ffcdc,restaurante,f19e52e1-d052-4127-9b00-67895f0c3fd2,Magni enim quam voluptates a beatae.,2,2024-12-03 07:30:00
0682b5dc-26fd-4269-9e94-668c9d2699f9,e0500b40-c45a-4532-9c59-910b0f3d09c2,restaurante,7d209538-831e-4608-ae37-85ebae181379,Corporis tempora sint corporis distinctio ex.,3,2024-09-29 08:15:00
d1713f3f-abaa-4930-9f05-6aac83d232e1,14799403-c023-4c97-af07-eb35cc0933b4,orden,dc988d68-64e1-4a64-b652-ffac0201e336,Rerum magnam in voluptatem laborum.,3,2025-01-19 05:00:00
cd6677d1-ec24-4892-b241-11f989300d35,aec3571d-62e6-4d0c-900a-efcfbe37b6f0,restaurante,c9869bfa-9ce6-4fe1-bed4-3fc3cd3d92e6,Odio iure iste possimus quia magni.,4,2024-10-25 12:30:00
38571310-627e-4039-a74a-10329846246c,ed28f0cb-126d-4015-b617-9ee9831a4932,orden,62d356ea-c932-456f-bebf-18f6e44f12f4,Ex assumenda fuga impedit voluptate quibusdam.,3,2024-07-08 19:15:00
8acdaf73-8fa0-45e0-a4e4-ec9095322b74,357ba3b4-cc00-4396-919d-4a37e0c30187,orden,9fa8a33e-d9eb-42bc-b1eb-9e504bf9fa54,Repellendus fugiat ratione id assumenda.,5,2025-01-30 22:15:00
6b484009-f71e-4e32-8080-3bd85c275629,7b00f6b1-6c36-4bfc-900a-e63a4a80437d,restaurante,01fc10f5-0cc6-45ea-a5ed-233c7a6d5c32,Possimus reiciendis facilis dicta commodi quas.,5,2025-03-17 14:15:00
ded18613-c674-4815-a7f3-ee5aed96f557,8141c368-8f9e-477c-aad3-18df3967d4db,orden,8abb56d4-7d7a-41f3-8e91-62875b05b3de,Voluptas impedit alias repellat.,1,2024-11-07 11:00:00
0b5969dd-8deb-4e38-9636-948ab7de46c0,7408a4e2-93d8-4149-8e97-f58d1a04b9c4,restaurante,27d612e4-bf03-45eb-8d9c-09f8ec0dcceb,Eius voluptates rerum maxime nisi.,1,2024-07-13 14:15:00
24f79df8-ace9-4f0d-b07f-622cc167c907,b5a90add-f997-4dad-9333-3b893e24c281,restaurante,46a97efb-086e-4311-82a7-5920c6797c54,Commodi aperiam soluta quo dolores earum eveniet maxime.,3,2025-01-20 19:00:00
7a02f321-7ff0-4c8f-a807-e27d0c19e080,641b1db8-0ff4-4f56-a98d-5976b3311992,restaurante,5b71ec1c-7cbd-4bdd-bcaa-3a0fe459c377,Nam amet cum a alias nemo aliquam.,2,2025-02-07 21:15:00
bf1af29f-5654-4b35-9f1a-2696b048b2fa,23b7571a-be04-4249-b02a-8e5752697ec7,orden,84af94f9-9752-4f83-80b5-2beffcc33246,Error suscipit pariatur labore voluptas.,4,2024-11-05 11:30:00
da291b82-10e7-47bd-aee0-2d368d41436b,eb8594b6-feae-46ea-b803-6b0c382b3494,orden,0291bd48-7dcc-428c-9fd8-2a070902d257,Laborum et incidunt facilis quis quisquam culpa.,1,2025-01-14 13:30:00
303fd64c-2830-4988-8098-cfa16864e05a,eaa49ee0-25ba-458a-aaec-96fc5df63289,orden,9822c96c-f690-44bf-886c-b400fb2e614e,Blanditiis nobis repudiandae optio rerum animi harum.,5,2024-08-23 08:30:00
38a6e53e-7824-47a6-a92a-f99ce6f0b813,1410bc05-b507-430b-bb1f-208716b92464,orden,afb6feb9-47f8-4aec-856f-2e6b3dc483d2,Eum accusantium beatae sit doloribus.,3,2025-01-20 19:15:00
1bdd0a21-778f-4335-90ef-061c0185d7d6,421d3a8c-32e3-4352-87cd-1e48c2520a4c,restaurante,27c5ab57-3c56-413f-b1ff-be5aca5ecc8b,Nisi harum esse voluptate unde amet.,2,2025-04-10 11:30:00
1febd5af-bb29-4632-8d95-617a37337191,39507950-b2b7-4cd3-854d-f06cec011a20,restaurante,4f36529c-2f0f-4c43-8e4f-8a46db63d4e4,Aut fugit facere quia laborum occaecati aliquam.,4,2024-07-17 15:30:00
e603dd82-13cb-4c9f-82fb-e9deda342fb5,39507950-b2b7-4cd3-854d-f06cec011a20,restaurante,30c25953-cb46-472a-99d7-b7b530b694e1,Optio quos voluptate iusto.,1,2024-11-04 15:00:00
d4214bd8-37f3-42a2-bf31-7ea54f0f67ce,be5735d7-0b10-434c-90db-7e0c560a8dc4,orden,b5ab7129-4e5a-457b-abea-fba75e363684,Commodi labore molestiae.,2,2024-11-22 17:45:00
90bd12c8-61cd-467b-939d-8d7c6e255d96,e0500b40-c45a-4532-9c59-910b0f3d09c2,restaurante,647d8e3d-8299-4e89-9c9f-8a34ebc16d72,Libero aliquid nesciunt impedit laudantium.,3,2024-08-13 06:45:00
68cb0698-fdcb-4608-8d1b-e94cbf93a216,2868b2c8-3288-47e8-ac20-bbff92acdeec,restaurante,01d1a67b-c4dc-40b4-96a8-7b98e84f939d,Libero molestias quaerat officiis porro vel.,2,2024-09-06 21:00:00
714c57e4-68e7-4072-b603-e94dd1aaffdc,db137620-89fd-4c0d-a769-e13af247518b,orden,c989f879-9148-4386-9bf3-8c27432b43bd,Hic amet nam amet.,1,2025-01-09 22:00:00
3c1c7638-5daf-4250-b44a-40d1ab4c5dd8,f7083f5a-7a6a-419b-8686-6f95ab293937,orden,ac993873-ad25-405a-83ec-5f101cbc2817,Debitis libero ut accusantium neque.,5,2025-03-11 06:00:00
19601832-12b0-43f7-a693-309fd3e297b0,5075f7de-b921-4b6f-9422-304ca0607b15,restaurante,e07a7a02-d249-4de1-b986-c97557340ed9,Repellendus labore alias similique expedita.,3,2024-06-28 05:30:00
3dcd30bc-3c33-4d73-9539-3bdd655201ff,8465f534-c9c2-442e-ad0b-6a52dae5c636,orden,95fc947e-0ebe-4a6d-b1f8-6773d1e0fff2,Maxime sequi deleniti voluptas.,4,2024-08-26 15:45:00
a48b4f2d-6897-4b01-8618-1e9b007e122d,5e339206-f9be-4117-bd18-4d80a25a1b23,restaurante,c4a9d6fc-cbf9-4756-8bc3-dfa6bda4591a,Aliquid iste temporibus minus eos officiis.,5,2025-03-19 00:15:00
fd94b871-1ca2-4274-ab17-0036d4bdb117,fd315413-4757-4f56-8c92-c321de95bf3e,restaurante,e70d6f89-034e-4682-bf16-0b40f9df7d06,Eaque exercitationem eligendi ipsa.,5,2024-08-17 12:45:00
0b5b392a-50f3-40a0-8003-573f15bdaa85,11f3963d-0a9b-40aa-8134-f3414a4b1890,restaurante,c929cb26-5c9d-43be-87ae-6df6ad0bcc97,Veniam explicabo sunt quis dolore.,1,2025-04-25 07:00:00
4308c950-93b4-4af5-ac19-5b9274db5dfd,c1f06cf6-02ff-484f-ae5e-c28962b4049d,orden,68237a6f-4fa3-4ea5-9d26-11051afa0384,Magni doloribus vel maxime.,1,2025-03-27 18:00:00
4205e570-3756-43fd-9c11-a317789f1e7e,3958a64a-3648-4024-9f4a-2105f11ca9ba,restaurante,389145d9-7ddd-4bdc-a6ed-678e519b0fda,Quod velit omnis.,4,2025-03-21 06:15:00
6e664a80-4ee2-48d4-95d1-cac2bd7eba37,bffaa73b-af4a-4c30-8e2d-a52a977266a8,orden,ebdddf2f-1fce-4008-a181-30a98125ac0b,Voluptatum eius possimus quo.,4,2025-01-01 09:15:00
dfa9ad7e-6eb1-4bfa-a5fe-480a39eb11c0,024549ed-9d7a-49da-b2c4-0e6ca64b3b2b,orden,9eb292d9-2161-48b7-8296-cd951cf91ac6,Totam eligendi quo perferendis.,2,2024-08-06 13:00:00
1f4ea3c7-9d72-49e0-af2b-1ab3c38f0966,fcbec341-cdcb-43d1-bed9-50644dc4889c,orden,a746be9d-6cc9-4078-b65d-e267b0842bbb,Ab dicta animi aperiam nesciunt earum illo.,4,2025-03-20 13:00:00
4523a232-05f7-4395-bcc3-8c7bdb9c4048,5a46f79e-8ca5-4666-9268-bd7b4eb3ddd5,orden,21db4900-03e9-4975-8a78-dfd316b3fec3,Rerum consequatur laudantium ut.,5,2025-02-14 02:00:00
31a95630-f5ea-4eb6-9f0a-23c24aaec103,98599e74-bb85-4153-bffe-2d1e3c643e3f,orden,90d1b54a-cd54-43a2-8db3-3063d5daf80f,Eaque ipsa explicabo officiis perspiciatis impedit.,3,2024-11-07 04:15:00
fefc6c53-62c1-4fdd-9e97-333e0fe574f4,eac2a31c-6d3d-47c3-8f49-cf16a4c9ff9e,orden,6a40a6c3-9ac3-4572-97aa-df4f493fd01c,Laudantium amet odio magnam.,2,2024-10-15 19:15:00
26ec0a8b-9c97-45ab-a6e6-efc2f8e35d05,7b00f6b1-6c36-4bfc-900a-e63a4a80437d,restaurante,e07a7a02-d249-4de1-b986-c97557340ed9,Optio iste non quod ut earum fugiat.,1,2025-01-03 04:45:00
62c69950-2364-4bad-9283-78ab0d89fc45,576c5fe7-62f9-4a20-8a88-e428af0f15ba,orden,2500b251-f6b3-43a0-9bb5-2152c0a99c67,Corporis tenetur assumenda exercitationem.,1,2024-05-31 06:45:00
d16b5d6a-a42f-49ba-9a78-2466f8b1c7a2,d7ecca77-12cf-49af-9178-bfb73002016e,restaurante,f3e969e5-6a06-4581-aca8-cef50a256d83,Officia saepe eveniet sit repellat.,4,2025-02-02 09:30:00
49951d3a-a868-4bbc-b7c0-2a2216c1e1ad,42770909-9b94-47aa-a84f-831f28eaa8e4,restaurante,e6d28ae4-5d91-4c9b-93bd-20c258c15441,Unde rem quod blanditiis aspernatur veritatis laboriosam.,1,2025-03-16 18:00:00
dc10b457-66cc-4024-bcaa-dde0a5a0a655,2adabb90-0571-43ae-9a2f-4eac434cfdf9,orden,1dc360fd-831b-4169-a7f0-65384fc55afb,Quasi totam iste reiciendis.,1,2025-02-27 07:30:00
2c30d4fc-4276-4f10-92d2-5fe9b89dfa98,a1bfc742-2e0f-460a-a1c3-95894c3fa7ec,orden,4aec5906-0257-438d-a521-cf13e20a5458,Aspernatur molestiae temporibus repudiandae.,1,2025-04-21 13:30:00
695c5e02-17c4-4bdc-ac53-94135a3ac05f,7408a4e2-93d8-4149-8e97-f58d1a04b9c4,restaurante,247eb99e-e8ae-457a-bdef-875a95f794d2,Praesentium beatae iure sequi ipsam laborum praesentium.,5,2025-03-01 16:00:00
82b3bb86-d5f6-4e80-82b9-f75645c88c24,c9c8f652-a2da-406f-a047-d5ed00023a4a,orden,5188e214-a309-4095-89e2-c204b8d122c8,Asperiores consequatur unde.,3,2024-05-12 06:00:00
68cb9560-2369-4530-80fa-c7769ee02452,f034d19a-2581-42b3-8078-49fa14c4dfa0,orden,863edc7e-f141-48b7-a073-6725576c8423,Voluptates libero eaque delectus vel deleniti cum neque.,2,2024-10-27 08:45:00
136862f6-d343-4047-aa38-14c242774826,fa6120ae-d70d-437a-abb5-1ba919e74d5f,orden,4e150ab9-6e95-4789-92c7-8b18cda50c28,Corporis maiores minus vel sapiente eius officia enim.,4,2024-08-02 14:45:00
d7516ba6-f129-412c-b5f4-51ea3703deb9,7e7da564-9f8e-4506-97ec-d50006ff3d90,restaurante,8c5904ca-4874-4579-ba42-52914dafe21e,Minus nihil neque.,3,2024-10-31 13:30:00
27e81695-ba8c-4c38-9826-b31765382ab3,7408a4e2-93d8-4149-8e97-f58d1a04b9c4,restaurante,d1797da5-cdb5-4fbd-9ba8-b3cd3d94b36f,Dicta quae culpa aut aspernatur exercitationem dicta.,1,2024-12-24 12:00:00
6e1652c7-53fb-44b5-a62c-ace156d2aa19,b3d3d5e6-8170-4366-95bc-6b08460e0985,restaurante,ccff0f67-92f2-4e52-9ae4-01c7ecfe8544,Dolor cupiditate natus cum quas.,1,2024-09-26 21:45:00
d1de206a-617e-4411-8dd2-ef2f1f49de19,dcf2d9a5-7f22-44bf-8228-97f57d38429f,restaurante,f9c8b9c6-e868-4f40-8452-1259a467689d,Corrupti illo ullam doloremque.,5,2024-06-15 05:30:00
35dbd662-47bf-499d-b31e-1f1abb10a778,093edfc5-491e-4b43-a22c-3046cd58c939,orden,624f85d5-2ccf-45fa-9d24-1a52ba6962ad,Sed impedit hic necessitatibus.,5,2024-09-29 03:45:00
ebf948ac-9295-4fb3-b2b3-b3e523786280,6baded74-4af8-47cf-acf6-4e307d3ad753,orden,8e8612ee-793b-4dc3-9863-e5ec0a1d1c49,Quo blanditiis nemo molestiae saepe assumenda.,2,2025-03-02 21:15:00
ccc2a734-a98c-414a-abd7-6eb055ce2aa5,96e385b5-44bc-4f75-9fb4-606cfe205873,restaurante,f5c1918e-6962-4447-b66f-8387e7f21ecf,Et dolores fuga alias suscipit.,3,2024-11-09 20:15:00
be7fed2f-a74a-4737-a8f5-34e95c9ef358,421d3a8c-32e3-4352-87cd-1e48c2520a4c,restaurante,875d591e-170e-4b42-b0ef-a409ac5140ad,Laborum dolor sed ab veritatis ab.,1,2024-09-11 04:45:00
d2eb677f-3e8f-48cb-9e2f-0220441098ee,f97c94d9-f87c-49a8-bbdb-06ce4cc1d9bd,restaurante,c465d8c1-341c-4d3b-9c2a-d68672629c18,Voluptatem unde repudiandae ipsam corrupti vitae officiis.,4,2025-02-05 06:00:00
ef596886-3a14-417e-a4f3-664f1b47b42c,3402ebfa-89d3-4983-a522-30361859b417,orden,0ae5a260-65b3-4217-9dc8-046559d9be2d,Nemo corporis temporibus magnam.,2,2025-04-05 11:00:00
9011619d-4ca0-4ec2-9707-4f353b2b4fe1,7408a4e2-93d8-4149-8e97-f58d1a04b9c4,restaurante,dab0fd79-9938-4dc3-bb3c-d52307117814,Quas est fugit vero delectus placeat asperiores.,2,2024-12-11 01:15:00
675a9b99-9876-4320-942a-7d5de1d75ced,a87e94ab-7f46-4dac-ad98-4a7bda1e0f3d,orden,398287e7-cea8-495a-8a53-4e92573f31f9,Tempora cumque maxime dignissimos officiis tenetur dignissimos natus.,2,2024-09-24 19:00:00
543db6bc-e936-4b2c-979f-ec6b38eae294,3aff2541-3857-4cce-8c7d-fde9f4a5e535,orden,847ab1fe-89a9-470e-a646-60417b3368e6,Illum voluptatum rem at dolorum ut sunt.,4,2024-12-11 17:00:00
d13abbc4-aba7-46c1-b6c8-6779102bbe21,7cf6f4e3-3cc0-4c0b-9fe7-edf277f53606,restaurante,a746be9d-6cc9-4078-b65d-e267b0842bbb,Repellendus sint natus nam incidunt eos eum.,3,2025-02-23 03:45:00
e5fea53a-7a4a-47da-a5d5-19c84f1d2030,772fb8fc-1bdb-4ccb-b812-e10088890597,orden,da33492f-f031-42b9-9f37-28d6f9b050de,Fugiat cupiditate ipsa molestiae ex veritatis accusamus suscipit.,5,2025-04-19 11:30:00
1086d387-3a94-4b81-a5a0-e67bd4855ae7,d2b409b8-e05e-4c2d-a0a4-8f3a819a2a86,restaurante,1d4c6315-9d6d-4157-86a2-8fb286fd4e2c,Delectus pariatur corrupti asperiores hic totam corporis.,5,2024-05-17 15:45:00
d2724294-7353-4082-a204-2d3de5f1561a,7045b51f-71e1-4195-b97f-3f967d092cab,orden,26cc400e-b3aa-4bb8-8ad1-d928726be810,Fuga necessitatibus excepturi deserunt reprehenderit.,4,2025-02-17 08:45:00
85acaf7c-7fb9-4df8-990d-e9ceb875d753,9a9a67c0-ab05-4fd6-abf9-83976245d5a3,orden,84a802b2-4158-4807-9c6e-772f8eeeb409,Cum ex facilis facere perspiciatis aliquam voluptas.,5,2024-12-03 23:30:00
a5cc3dbb-cd19-4e2e-b7b9-a997d5688eea,a5c29294-2fe1-4331-9239-31397bc5fd44,orden,2ec7fc37-ec74-4ac9-82cd-e25b9b5e15cc,Magnam nostrum consectetur dolores dolorum.,5,2024-10-29 21:45:00
0c47f01e-a664-4c09-8d45-2b2c497fde7f,fd92b64c-731e-40cc-9c31-56e5e98c5c63,orden,ff28c7db-e479-430c-82a6-72af2c539fd4,Maiores alias repellat quae ipsam ipsa.,5,2024-08-03 10:15:00
55bbfa93-9e13-4c81-a350-490d8e157b68,afc1bd54-c4ed-4a60-bea4-df6981ef2728,orden,cc0dd6de-4a1d-4dd4-a6e8-6f2bbc33cc39,Perspiciatis autem laudantium atque eum pariatur.,1,2024-12-28 22:15:00
ce49e96e-dfc1-456a-95c6-d3f46cb4bbf4,6c442206-ce82-4bcc-92da-f1539b2ea16f,orden,0a027433-faa7-420c-b009-8b8a98bf5999,Error neque quis itaque eaque vitae.,1,2024-08-26 04:15:00
1642a006-16a2-4000-89bb-3ada117a13c3,dcf2d9a5-7f22-44bf-8228-97f57d38429f,restaurante,206105a6-ecaa-4edc-98e0-4618f79e3438,Enim labore ipsum esse at ipsum quis.,4,2024-10-05 11:45:00
235026c1-a9cb-420b-a7c5-675a25884e4c,06abc9d6-f7f9-48ba-90ae-81c4dd6ea198,orden,0d61e199-d230-42fc-9e87-e6bfd1de8fcf,Pariatur perspiciatis voluptatibus ipsum dolorem ab itaque.,2,2024-08-08 02:00:00
410fca0a-3d2b-4e25-b06c-935b02a1be03,a292fa58-b97d-47bc-8981-ea59fe94f71e,orden,759f1452-3348-49ce-8d3a-ce2181e3b52f,Aut deserunt soluta nulla quis.,5,2025-04-18 11:45:00
33db95e5-63d1-437f-b7a7-9d1e659ac25b,5074bb6e-cbf1-4e9c-9b2d-92243cdaa263,restaurante,7d892d2b-f468-4a0f-a5a8-4ca30d427e35,Iste maiores possimus distinctio.,1,2024-05-30 19:30:00
61f63da8-728f-4638-8da1-f1b87473533d,dcf2d9a5-7f22-44bf-8228-97f57d38429f,restaurante,b82e2a14-01bc-4a44-affc-cd8488f33543,Numquam reiciendis consectetur quod sint totam esse.,5,2025-03-12 12:45:00
84890c62-02c9-4100-bfdc-5269de80674f,8af065b6-670b-4a07-9541-c06257e028c9,orden,fd336809-405b-4255-be3e-7b34233110fd,Doloribus tempora odit numquam eligendi.,1,2025-01-29 16:15:00
c339d70d-3ec3-4844-8056-be05b242a585,4496b984-900a-4498-a80c-29c2ab0ca251,orden,7918790f-4ec4-4b05-ae72-4f2b5346d57d,Sit natus nisi tempora laborum accusamus eligendi inventore.,4,2025-03-20 04:15:00
20dd2361-3aa0-4ce9-b3fa-b4088fc7c10f,5a4ffc5d-dc88-4260-96d6-7874d8753b9c,orden,111476ef-a77c-4908-8ed4-b843b7d898ed,Corrupti ducimus porro nostrum iure nemo repellat.,2,2024-12-17 15:00:00
2158dbd5-f756-444b-9ffc-0928c792c16d,fa9892fa-f13c-4cd3-8dec-ec745cb2eac5,restaurante,bcd3a9ae-7eaf-4409-8a0e-690dd0ddbc96,Nulla nostrum alias minima beatae.,5,2025-03-10 03:45:00
45b920d4-b05e-474f-90f8-ca8ec21f90a0,27c3098a-e778-456c-bce5-7f4526774bff,orden,17bd7264-d196-4fee-bf10-8c9f565e921c,Sunt est beatae.,3,2024-11-14 19:00:00
e3ecee37-0c44-4710-b8a3-b15fabb16195,e0d0ec8f-7e7c-4e2c-95f5-f52789af2bf3,orden,dae6285d-fd49-4aaa-99d6-a327295ab8c7,Nesciunt voluptatibus earum expedita occaecati qui.,1,2024-05-24 06:00:00
f765298c-f06c-40a1-96dc-82cc1fdf3bad,aec3571d-62e6-4d0c-900a-efcfbe37b6f0,restaurante,cd2fd29c-5faf-4852-8180-9a469cc45773,Ducimus quam repudiandae hic velit saepe.,3,2024-09-08 17:30:00
38c38874-6ad1-4ffe-9e44-9ed6976e2814,b5a90add-f997-4dad-9333-3b893e24c281,restaurante,603e1681-423e-4d3b-afd8-f9eb4459e1e4,Ratione eligendi inventore sint quaerat.,2,2024-08-09 19:30:00
37b98376-2de3-4387-9ab3-e22a5e8839a9,790066ae-d4f8-4872-9be4-cb5348fa7009,orden,f6eea67a-0997-4220-8a3a-600c4b4eed36,Alias incidunt at perspiciatis omnis voluptatum.,1,2025-04-23 06:45:00
fcefe7cd-b32a-4db6-a498-62e13791593d,b41a51dd-485f-49c4-9e99-a30df342d8fa,orden,daaa9c5b-1bf6-44f1-8928-65b16796bb11,Quas veniam assumenda eligendi.,4,2025-03-14 09:30:00
d1877efb-5757-401c-87f1-36dbf7b2862e,f7083f5a-7a6a-419b-8686-6f95ab293937,orden,0d30bf70-2ead-4442-bf27-4140fcd5b6ad,Dolor tenetur excepturi minus.,1,2025-04-25 12:00:00
3212f659-3fb0-4356-bdca-ab04863e4fcd,2dee7331-b15b-4909-a738-6989219bff8d,orden,c9d3fea4-c909-4cbe-a7b0-42c27ae348f5,Labore molestias tenetur ex iste perferendis aliquam expedita.,5,2024-12-04 22:45:00
ccef903c-87c0-4a18-bef3-04d61031e236,5e339206-f9be-4117-bd18-4d80a25a1b23,restaurante,6918241b-9e13-494d-94aa-06c575f41013,Magnam quas explicabo minus.,3,2024-05-16 18:30:00
372ddd69-a9f7-410f-a228-57ce11127d80,d7ecca77-12cf-49af-9178-bfb73002016e,restaurante,ed5fe09c-51a0-4cae-b693-b1fa780ce981,Ea assumenda sint dicta vero.,5,2024-12-10 22:30:00
b32a5d24-06e3-48f9-9d76-8c78bc1797fe,e2107a87-8dfc-4ee3-b625-2fdb1772a882,orden,687655b6-2d9a-48cd-9d3a-160763caf6bc,Totam accusantium ut nam veniam quidem earum a.,4,2024-08-03 15:15:00
7e105bd3-29df-4c2d-a46b-843629aca253,90603a8f-1c77-4df7-9f90-2b9b090b8d26,restaurante,d8df5c36-d57e-41dd-a43e-16863b4271a3,Illum neque maiores nulla.,4,2024-11-21 23:45:00
49997af1-163c-408b-8686-7a723acf6191,6e6ae2d7-8356-4f53-93ff-023ce15ddc29,orden,20d1fd63-6036-41a8-b53a-412b9e0e00cc,Eum at suscipit consequuntur.,5,2025-02-24 13:15:00
e23ea7ee-ece8-460c-b43c-31b7ecd54e24,772fb8fc-1bdb-4ccb-b812-e10088890597,orden,b6095f8c-4154-47a1-8771-09b497a1eb8f,Autem illum ipsa aspernatur laborum iure.,5,2024-09-27 12:30:00
904eea85-0485-4e82-a77a-7899a58af0bf,2868b2c8-3288-47e8-ac20-bbff92acdeec,restaurante,f4ba5605-aff6-4224-8fae-084d325000ef,Quasi occaecati laboriosam.,3,2024-11-11 01:45:00
a42a2491-3aa2-4cd7-a147-0153ed57d91a,67747616-0aea-4292-8edc-334f61cca217,restaurante,15dee954-4527-41a9-940a-2663f0ad9ac3,Ad atque esse magni itaque.,1,2024-11-03 03:00:00
b533ab8f-fb52-43f1-88d6-86b40acddb90,78789d90-e703-4fc6-ab54-8323e8a5433a,orden,09b01ba6-4529-4312-b548-e5a8d72391f1,Eligendi corporis accusamus cupiditate hic reprehenderit quo.,3,2024-05-25 00:45:00
60f1a683-4691-46e4-b7b7-d531d0e7ffa2,7725f871-5007-4729-8629-5c3741dbc537,orden,4f36529c-2f0f-4c43-8e4f-8a46db63d4e4,Consectetur beatae quidem autem eos ullam.,1,2024-09-28 04:00:00
181378e6-b5f1-4d5a-81a1-369e214d28b0,7408a4e2-93d8-4149-8e97-f58d1a04b9c4,restaurante,f1029179-e9d6-4e28-bd45-eaa6ce70eb16,Quia nobis cupiditate doloremque a.,2,2024-06-15 15:00:00
9230c965-3849-4ed8-a29a-62cd18bf9aa7,750c2ea8-ace7-452d-a091-57de2e42e03e,orden,b5ab7129-4e5a-457b-abea-fba75e363684,Ipsa repellendus libero perferendis magnam.,5,2024-05-12 17:00:00
0394fe30-c641-41b3-a8cc-aee3e6499c4f,0a685dc4-e975-4d54-a8ca-dde068140a80,restaurante,813f5391-97f5-46f8-9812-176f943265be,Praesentium repudiandae fugit optio et corporis.,3,2024-09-12 23:15:00
72d33107-59f9-40bc-8fd3-70e7b78762a7,9e1b0f7c-d376-400b-b3fa-f594dd6c4e9a,restaurante,22587270-13e6-449f-8728-5540939b9e01,Cupiditate architecto veniam laboriosam aliquam sapiente alias quo.,4,2024-07-16 01:45:00
75f46706-cd2a-4fc4-acf1-a75a84b9b76d,15962fe0-b996-40ac-b21b-e22cf259d441,restaurante,7d892d2b-f468-4a0f-a5a8-4ca30d427e35,Ex minus repudiandae eaque labore magnam atque.,3,2024-12-10 13:00:00
0fc3ce3f-5e0f-4a4a-89a4-18be52633eec,ea1568ca-bb91-40d5-94f6-29bc2e3c6cfd,restaurante,16d998d3-2a50-49b1-a7e2-e02a9a573c9d,Officia alias architecto laborum aspernatur.,1,2024-08-23 07:00:00
b5fe465b-2c39-43fc-8e7a-3e125c7c424d,e6e9c831-4130-41e8-a89c-ca7f2ace92bd,restaurante,64295097-809d-4227-95ed-7745fed34315,Excepturi similique libero quos pariatur aperiam doloremque.,5,2025-04-12 15:15:00
e1e93aa6-8bcf-40a8-98e8-b6b8c070466b,0a685dc4-e975-4d54-a8ca-dde068140a80,restaurante,624f85d5-2ccf-45fa-9d24-1a52ba6962ad,Ducimus error labore fuga minima.,5,2025-02-13 04:00:00
510c7b7b-82ee-441e-9e93-0888f81fb23f,96e385b5-44bc-4f75-9fb4-606cfe205873,restaurante,92973aca-e06a-48b1-bcce-0750f6541cbb,Error eaque molestias velit.,1,2024-05-30 11:00:00
81d0c992-78ea-4f39-9ca0-17a1cc47bcb8,fa9892fa-f13c-4cd3-8dec-ec745cb2eac5,restaurante,6fe48a27-39b6-4ef6-a255-45572970d836,Corrupti et repudiandae.,3,2024-11-29 03:45:00
fbcce349-d59d-4a2d-a139-290906f86101,69168234-1c5a-4612-89b9-22c298ed07ae,restaurante,ad60a584-0c13-43ed-8564-9dca918a9afe,Illum odit nesciunt corporis.,1,2025-04-17 13:30:00
b73316a2-ed0a-4223-83fc-2dbb36537702,4de3d63b-3ee9-441a-a641-e472dcfd9f39,orden,c06b9369-d99e-418e-9b18-7f8de5348b81,Delectus placeat nemo fuga nisi accusantium.,1,2024-08-26 11:45:00
e24d5511-f527-4071-bdd6-01a3160917e7,9a08bff3-1cfb-4b10-933d-980c5623b5af,restaurante,0b70d399-ef97-433a-87d9-24321c15e2ab,Praesentium error officiis aliquid aspernatur.,1,2025-04-15 21:00:00
1894f69d-585e-4963-822f-3a4af8701006,360a8b6f-f2d6-4e31-8565-355b848e6b4a,orden,04e8c7b9-0ed4-4ab8-bb17-58d2c052f5dc,Architecto numquam suscipit.,1,2024-09-24 18:45:00
7e0253b2-b251-4150-94b8-50d7faa60680,356db916-7241-4da4-8419-a310f5ce4665,orden,54288b46-462f-44eb-8a39-39399c8925b7,Alias temporibus iure qui eligendi.,2,2024-06-29 12:15:00
3b965bb1-96f5-489d-8067-36bbbd7e31aa,8c2f8435-21c3-41b8-a000-8cbb2e8ef2a6,orden,a54ba29c-a8e7-4cae-bd06-5133d110fbb5,Nesciunt ea molestiae corrupti dolorum iure possimus.,3,2025-04-27 16:00:00
a3389d44-9730-4cb5-940a-6a230e177fee,81c3209b-395c-4395-b443-b65464f69fd6,orden,d87cc97a-2099-44bf-bfbb-5db97635b256,Vero rerum molestiae consectetur ducimus repellat.,2,2024-05-28 05:30:00
a9a49700-83cd-4458-9b1e-cbb137d53530,e00d241d-c2dc-46dd-ac97-97ca3e40056e,orden,ecca5d81-9402-4b4e-afc6-01bb7401a24a,Necessitatibus esse cupiditate veniam.,5,2024-11-27 17:15:00
68ee2d95-3df8-4b12-80d9-14d1210db5d1,421d3a8c-32e3-4352-87cd-1e48c2520a4c,restaurante,3e880f1d-9440-4bba-827e-2e623a7a5e13,Placeat nulla libero.,5,2024-10-17 23:30:00
502ef212-51a0-492c-b616-16ae6bd8e5d9,730b33d0-d9a0-4398-a2b3-f74f443aab30,orden,c767eaa9-b6b7-48e0-963f-8f9e7900850d,Animi neque delectus adipisci fuga.,4,2025-01-27 09:00:00
c42b24ac-8955-45a1-aa73-11724db2373c,11f3963d-0a9b-40aa-8134-f3414a4b1890,restaurante,e353eb64-59e4-4b13-bcd9-34fc9265915e,Itaque ratione alias quaerat.,1,2025-01-13 13:00:00
d2ad0d61-b568-4196-9157-6cfab46ab6e9,546afa7e-ebac-4c9e-b298-becf456c3c3e,restaurante,5fe7327d-c68a-4a01-9b11-9467b2019976,Aliquid omnis quia modi id debitis.,3,2024-11-22 02:00:00
32ea665f-adc8-4726-bcc7-1a9591e3ab39,67747616-0aea-4292-8edc-334f61cca217,restaurante,e91ea890-bff0-4e9d-b2a7-f36822139067,Ullam commodi dicta doloribus sunt delectus veniam.,3,2025-01-01 06:30:00
bf5743d8-d543-4383-ba1d-cbbdf6b7fca0,641b1db8-0ff4-4f56-a98d-5976b3311992,restaurante,eedc5521-8209-48c8-8dca-d2745c7258d8,Quasi fugit id rerum.,2,2025-04-22 21:15:00
c04f481f-5a5a-4cd2-aee4-cba1bd8a6e6d,9a08bff3-1cfb-4b10-933d-980c5623b5af,restaurante,cdf59b88-ba99-421d-a096-9467b80540b0,Atque nesciunt nostrum quo porro eum minus.,3,2024-05-16 22:30:00
25f3d24d-816c-48fa-8009-dc2b1e27dc01,093edfc5-491e-4b43-a22c-3046cd58c939,orden,f4ba5605-aff6-4224-8fae-084d325000ef,Illo possimus aut veniam doloremque unde.,2,2024-08-15 14:15:00
bd8b5fdd-c3ed-4abb-b400-bdee398b2eb2,d02524b3-fec5-475a-8893-8294ba269585,orden,c023f92a-af8a-41f8-84ed-226f7747569d,Cupiditate quae hic suscipit magnam libero.,2,2025-01-11 12:30:00
297f918c-7246-4983-ad60-905f783933d1,48d2a674-5f4d-4dc4-9e47-17167d98ebcd,orden,d673c7b2-70a9-449a-9072-3f6e882f1747,Laborum facere nisi quidem ad harum.,5,2024-05-04 08:45:00
e7a0686f-3c84-4de9-923a-7739cf36d551,024549ed-9d7a-49da-b2c4-0e6ca64b3b2b,orden,24cbc91e-26ce-4118-9615-630cbeef9a9f,Consequuntur nostrum at quaerat aliquam ut placeat.,2,2024-11-13 03:30:00
e0aafe3a-3816-4e69-a87d-a8af5812fc78,d8bd3f24-2654-4548-ab54-34d921f8fa5c,orden,5188e214-a309-4095-89e2-c204b8d122c8,Omnis rem doloremque laborum fugiat dolores laborum.,1,2024-07-28 23:30:00
5467d455-64f5-4858-8af4-4ca67133c126,487fad7c-9149-417e-9334-c6701f81d4b0,orden,3c3f6e72-881b-43dc-9a81-759a43d0cde2,Excepturi similique dignissimos eveniet maiores suscipit facere.,4,2024-09-09 05:45:00
d8557728-d968-4200-88e8-af38f3d877d0,295d8818-fe5a-40d6-b108-f123e715b74f,restaurante,cefed951-3ef8-4e2e-95f5-4559b5d0f34c,Molestiae tempore cum quibusdam sequi sint.,4,2024-10-10 03:15:00
bbd7242f-3d15-4c53-9c18-79b57d555567,7b00f6b1-6c36-4bfc-900a-e63a4a80437d,restaurante,d8df5c36-d57e-41dd-a43e-16863b4271a3,Quae ea harum placeat natus qui in dolor.,5,2024-05-21 13:30:00
bfc53fb0-92ce-491e-847e-26e8ad45735f,b5a90add-f997-4dad-9333-3b893e24c281,restaurante,66ff808c-d9d5-4c13-91f1-32c987e3c632,Perferendis vel officiis provident sed necessitatibus temporibus natus.,4,2024-05-21 10:15:00
dfb3a7aa-0f7b-4cc9-99e1-966067c50118,488d151b-d82f-4afa-b1af-ba9649a9cc75,orden,6deee185-98d5-427c-8b03-a2db8db900b8,Neque a corrupti quae aut officiis doloremque eius.,4,2025-04-04 23:15:00
e5914437-14b7-4b59-a174-ce239e0052af,5075f7de-b921-4b6f-9422-304ca0607b15,restaurante,da4f8809-2035-439c-9e21-207a36b4c136,Similique nesciunt porro consequatur dolore magni.,5,2024-12-24 03:30:00
c7aff558-6249-4fc4-9a02-76461a27512c,04f96d77-72d1-49ef-955a-050f476f607e,orden,06ed9415-2f50-4c5f-b571-7b3cb5776e5a,Veniam perferendis magni ex sequi eius.,1,2025-02-01 09:30:00
a913f374-6580-48cf-8cda-26093c3f9f3e,aec3571d-62e6-4d0c-900a-efcfbe37b6f0,restaurante,62d356ea-c932-456f-bebf-18f6e44f12f4,Nisi quas quidem perferendis tempora a.,3,2024-12-25 18:45:00
4fff1056-81cb-45aa-ad4d-35308b505037,f303deb5-f4cf-4cd0-85d1-d5546529d8a5,orden,18f88c9d-edf2-47f8-8ed4-6358d7692374,Labore nobis eveniet vero cupiditate earum nulla.,5,2024-11-21 15:30:00
51e0c0f6-03e4-4da0-95cc-df2973cec8ef,10fc50c1-e607-4519-88f2-4346462811a7,orden,c0d04678-b1d6-4106-9a38-8ab87e37a443,Assumenda voluptatum amet dolorum cumque.,2,2024-12-16 21:45:00
ae66f762-b7fd-4da7-981e-c83fab92b958,97805341-6f3d-4c99-813b-94da786285f5,orden,78232ef0-110d-407f-8334-1e78ffc861c4,Placeat animi ea provident perspiciatis.,3,2025-02-18 13:30:00
e628cd80-98bc-4ac6-8373-7a4e72182f3f,5074bb6e-cbf1-4e9c-9b2d-92243cdaa263,restaurante,d8d45526-f8a2-462e-94a6-25f61d7e9b4b,Quaerat unde tempora dignissimos non excepturi.,3,2024-12-17 17:30:00
